No.,Title,Artist,Lyrics_URL,Lyrics
17,"""I Know You Want Me (Calle Ocho)""",Pitbull,https://genius.com/Pitbull-i-know-you-want-me-calle-ocho-lyrics,haha mr. 305 checkin remix know 75 street brazil well gon called calle ocho hahahaha ¿qué bola cata qué bola omega gon dale one two three four uno tres cuatro know want know want ya know want eh know want ya know want know want ya know want eh know want ya one two three four uno tres cuatro rumba sí ella quiere su rumba rumba sí ella quiere su rumba si e verdad que tú ere guapa yo te vo poner gozar tú tienes la boca grande dale ponte jugar one two three four uno tres cuatro tick tock way top huh pit got locked goon lock yuh r.i.p. uh big pac damn hot label flop pit wo stop got cockpit playin pit watch make movie like albert hitchcock haha know want know want ya know want eh know want ya know want know want ya know want eh know want ya one two three four uno tres cuatro rumba sí ella quiere su rumba rumba sí ella quiere su rumba si e verdad que tú ere guapa yo te vo poner gozar tú tienes la boca grande dale ponte jugar one two three four uno tres cuatro mami got as like donkey monkey look like king kong welcome crib 305 woman ya play game chain love everythang anythang anythang love get get night long know want know want ya know want eh know want ya know want know want ya know want eh know want ya one two three four uno tres cuatro rumba sí ella quiere su rumba rumba sí ella quiere su rumba si e verdad que tú ere guapa yo te vo poner gozar tú tienes la boca grande dale ponte jugar one two three four uno tres cuatro baby get play baby got crib got condo stay even got king-size mattress lay baby care care say 'cause know want know want ya know want eh know want ya know want know want ya know want eh know want ya one two three four uno tres cuatro rumba sí ella quiere su rumba rumba sí ella quiere su rumba si e verdad que tú ere guapa yo te vo poner gozar tú tienes la boca grande dale ponte jugar one two three four uno tres cuatro
18,"""Live Your Life""",T.I. featuring Rihanna,https://genius.com/Ti-live-your-life-lyrics,miya hee miya ho miya hu miya ha-ha miya hee miya ho miya hu miya ha-ha miya hee miya ho miya hu miya ha-ha miya hee miya ho miya hu miya ha-ha ay ... special happenin soldier iraq e'rybody right need thankful life got y'knowmsayin stop lookin got start bein thankful got let give 'em baby girl hey gon na shinin star fancy clothes fancy car see gon na go far 'cause everyone know ya are-are live life ayyy ayyy ayyy steady chasin paper live life ayyy ayyy ayyy got time hater live life ayyy ayyy ayyy tellin take ya live life ayyy ayyy ayyy 'cause paper chaser livin life life life life livin life life life life livin life hey never mind hater say ignore 'em 'til fade away amazing ungrateful game gave away safe say paved way cat get paid today still wastin day away never saved day consider protege homage think pay instead bein gracious violate major way never hater still love 'em crazy way say sold yay know could get work labor day black white area shade gray westside anyway even left today stayed away move away make way move away cause afraid brought back hood ever take away pray patience make wan na melt face away like made 'em spray could make 'em put k away thuggin life ca say deserve take break rather see catch case watch future fade away gon na shinin star fancy clothes fancy car see gon na go far 'cause everyone know ya are-are live life ayyy ayyy ayyy steady chasin paper live life ayyy ayyy ayyy got time hater live life ayyy ayyy ayyy tellin take ya live life ayyy ayyy ayyy 'cause paper chaser livin life life life life livin life life life life livin life opposite moderate immaculately polished spirit hustler swagger college kid allergic counterfeit impartial politics articulate still grab nigga collar quick whoever havin problem record sale holler tip work else fails turn around follow tip got love game ay love could without fame rapper nowadays comedy hootin hollerin back forth arguin know make kind car seems though lost sight important depositin check bank account poverty value disarray prioritizin horribly unhappy rich cause piss poor morally ignorin prior advice forewarnin mighty full sudden gon na shinin star fancy clothes fancy car see gon na go far 'cause everyone know ya are-are live life ayyy ayyy ayyy steady chasin paper live life ayyy ayyy ayyy got time hater live life ayyy ayyy ayyy tellin take ya live life ayyy ayyy ayyy 'cause paper chaser livin life life life life livin life life life life livin life got everybody watchin come walk shoe see way livin really want got mind money goin awayyyyyyy keep gettin paper keep climbin look mirror keep shinin game end 'til clock stop gon post top spot livin life life windmill city got whole team life life wan na livin life life never lose livin life life never stop miya hee miya ho miya hu miya ha-ha miya hee miya ho miya hu miya ha-ha miya hee miya ho miya hu miya ha-ha miya hee miya ho miya hu miya ha-ha live life
19,"""Kiss Me thru the Phone""",Soulja Boy Tell 'Em featuring Sammie,https://genius.com/Soulja-boy-kiss-me-thru-the-phone-lyrics,soulja boy tell 'em baby know miss wan na get tonight baby girl issue girl know miss wan na kiss ca right baby kiss phone see later kiss phone see get home baby know like future wifey soulja boy tell 'em yeah bonnie clyde could wife text call need life yeah day every day need ya every time see ya feeling get deeper pre-chorus soulja boy sammie miss ya miss ya really wan na kiss ca six-seven-eight triple nine eight-two-one-two baby know miss wan na get tonight baby girl issue girl know miss wan na kiss ca right baby kiss phone see later kiss phone see get home baby thinkin lately much everything like love kissin public thinkin nothin rose dozen talkin phone baby sexy voice lovely love complexion pre-chorus soulja boy sammie miss ya miss ya miss ya really wan na kiss ca six-seven-eight triple nine eight-two-one-two baby know miss wan na get tonight baby girl issue girl know miss wan na kiss ca right baby kiss phone see later kiss phone see get home call phone like da da da-da-da-da-da-da da-da-da-da-da-da da-da-da-da-da-da phone like da da da-da-da-da-da-da da-da-da-da-da-da da-da-da-da-da-da taking pic like da da da-da-da-da-da-da da-da-da-da-da-da da-da-da-da-da-da dial number like da da da-da-da-da-da-da da-da-da-da six-seven-eight triple nine eight-two-one-two baby know miss wan na get tonight baby girl issue girl know miss wan na kiss ca right baby kiss phone see later kiss phone see get home
20,"""Down""",Jay Sean featuring Lil Wayne,https://genius.com/Jay-sean-down-lyrics,baby even sky fallin oughta know tonight night let go put show wan na see lose control leave behind 'cause night get away come fly make great escape baby worry wo lonely even sky fallin need worry baby baby even sky fallin let come bring body next take away hey turn place private getaway leave behind 'cause night get away come fly make great escape run away chorus jay sean lil wayne baby worry wo lonely even sky fallin need worry baby woo baby mmh even sky fallin like 'posed get low like temperature 'cause zero degree cold over-freeze got girl overseas miss america soldier please fightin girl battlefield love look like baby cupid sendin arrow ever leave side indefinitely probably honestly like economy yeah chorus jay sean lil wayne baby worry wo lonely whoa even sky fallin babe need worry baby mmh baby ooh no-ooh sky fallin even sky fallin outro jay sean lil wayne ooh no-ooh sky fallin c3
21,"""The Climb""",Miley Cyrus,https://genius.com/Miley-cyrus-the-climb-lyrics,almost see dream dreaming voice inside head saying never reach every step taking every move make feel lost direction faith shaken got ta keep trying got ta keep head held high always gon na another mountain always gon na wan na make move always gon na uphill battle sometimes gon na lose fast get waiting side climb struggle facing chance taking sometimes might knock breaking may know moment gon na remember yeah got ta keep going got ta strong keep pushing 'cause always gon na another mountain always gon na wan na make move always gon na uphill battle sometimes gon na lose fast get waiting side climb yeah always gon na another mountain always gon na wan na make move always gon na uphill battle sometimes gon na lose fast get waiting side climb yeah keep moving keep climbing keep faith baby climb keep faith keep faith whoa-ooh-oh
22,"""Best I Ever Had""",Drake,https://genius.com/Drake-best-i-ever-had-lyrics,know lot girl thinkin song get confused one baby everything ever wanted could real big bigger ever done everything hoe never want forever swear spend whatever 'cause hold every time hit get right promise gon live made beg 'til give say thing every single time say fuckin best fuckin best fuckin best fuckin best best ever best ever best ever best ever say fuckin know got roommate call one put key mat know yup shawty hittin spot even know even ask twice could heart could share like last slice always felt like accustomed fast life nigga thinkin met past life sweatpants hair tied chillin make-up prettiest hope take wrong even trip friend say bringin drake along know workin soon make home patient waiting room never pay attention rumor assume girl prove one never get confused 'cause baby everything ever wanted could real big bigger ever done everything hoe never want forever swear spend whatever 'cause hold every time hit get right promise gon live made beg 'til give say thing every single time say fuckin best fuckin best fuckin best fuckin best best ever best ever best ever best ever say fuckin sex love pain baby tank shit buzz big could probably sell blank disc album drop bitch buy picture nigga buy claim got sister magazine paper girl money issue bring dinner room ask initial call referee 'cause official shirt got stripe make pussy whistle like andy griffith theme song told put jean double cup love one lean feelin fix really get fiend yeah know condo crack spot every single show reppin like mascot get back make fuckin bra strap pop slot 'til nigga hit jackpot saying baby everything ever wanted could real big bigger ever done everything hoe never want forever swear spend whatever 'cause hold every time hit get right promise gon live made beg 'til give say thing every single time say fuckin best fuckin best fuckin best fuckin best best ever best ever best ever best ever say fuckin best fuckin best fuckin best fuckin best best ever best ever best ever best ever uhh ah yeah see type joint got ta dedicate somebody make sure special somebody young money yeah yeah know got
23,"""My Life Would Suck Without You""",Kelly Clarkson,https://genius.com/Kelly-clarkson-my-life-would-suck-without-you-lyrics,guess mean sorry standin door guess mean take back said like much wanted anyone said never come back 'cause belong together yeah forever united somehow yeah got piece honestly life would suck without maybe stupid tellin goodbye maybe wrong tryna pick fight know got issue pretty messed either way found nothin without 'cause belong together yeah forever united somehow yeah got piece honestly life would suck without dysfunctional really miss ca let go oh yeah 'cause belong together yeah forever united somehow yeah got piece honestly life would suck without yeah 'cause belong together yeah forever united somehow yeah got piece honestly life would suck without
24,"""Halo""",Beyoncé,https://genius.com/Beyonce-halo-lyrics,remember wall built well baby tumblin even put fight even make sound found way let never really doubt standin light halo got angel like awakened every rule breakin risk takin ever gon na shut everywhere lookin surrounded embrace baby see halo know savin grace everything need written face baby feel halo pray wo fade away feel halo halo halo see halo halo halo feel halo halo halo see halo halo halo ooh hit like ray sun burnin darkest night one want think addicted light swore never fall even feel like fallin gravity ca begin pull back ground like awakened every rule breakin risk takin never gon na shut everywhere lookin surrounded embrace baby see halo know savin grace everything need written face baby feel halo pray wo fade away feel halo halo halo see halo halo halo feel halo halo halo see halo halo halo ooh feel halo halo halo see halo halo halo feel halo halo halo see halo halo halo ooh halo ooh halo ooh ooh everywhere lookin surrounded embrace baby see halo know savin grace everything need written face baby feel halo pray wo fade away feel halo halo halo see halo halo halo feel halo halo halo see halo halo halo ooh feel halo halo halo see halo halo halo feel halo halo halo see halo halo halo ooh
25,"""Hot n Cold""",Katy Perry,https://genius.com/Katy-perry-hot-n-cold-lyrics,change mind like girl change clothes yeah pm like bitch would know overthink always speak cryptically know good 'cause hot cold yes wrong right black white fight break kiss make really wan na stay really wan na go-o hot cold yes used like twin sync energy dead battery used laugh 'bout nothing plain boring know gon na change 'cause hot cold yes wrong right black white fight break kiss make really wan na stay really wan na go-o hot cold yes someone call doctor got case love bipolar stuck roller coaster ca get ride change mind like girl change clothes 'cause hot cold yes wrong right black white fight break kiss make hot cold yes wrong right black white fight break kiss make really wan na stay really wan na go-o hot cold yes
26,"""Second Chance""",Shinedown,https://genius.com/Shinedown-second-chance-lyrics,eye open wide way made day watched world outside way leaving today well saw halley comet waved said always runnin place even man moon disappeared somewhere stratosphere tell mother tell father done best make realize life hope understand angry saying sometimes goodbye second chance please cry one tear afraid say one voice listen close today well saw halley comet waved said always runnin place even man moon disappeared somewhere stratosphere tell mother tell father done best make realize life hope understand angry saying sometimes goodbye second chance chance chance tell mother tell father done best make realize life hope understand angry saying sometimes goodbye second chance sometimes goodbye second chance sometimes goodbye second chance
27,"""Circus""",Britney Spears,https://genius.com/Britney-spears-circus-lyrics,two type people world one entertain one observe well baby put-on-a-show kinda girl like backseat got ta first oh oh refrain britney spear claude kelly like ringleader call shot call shot like firecracker make hot put show feel adrenaline movin vein spotlight ready break like performer dance floor stage better ready hope feel eye center ring like circus crack whip everybody gon trip like circus stand watchin follow show everybody let go make dance floor like circus two type guy one hang one scared baby hope came prepared run tight ship beware refrain britney spear claude kelly like ringleader call shot call shot like firecracker make hot put show feel adrenaline movin vein spotlight ready break like performer dance floor stage better ready hope feel eye center ring like circus crack whip everybody gon trip like circus stand watchin follow show everybody let go make dance floor like circus let go let see runnin yeah like eye center ring like circus crack whip everybody gon trip like circus stand watchin follow show everybody let go make dance floor like circus eye center ring like circus crack whip everybody gon trip like circus stand watchin follow show everybody let go make dance floor like circus
28,"""Day 'n' Nite""",Kid Cudi,https://genius.com/Kid-cudi-vs-crookers-day-n-nite-lyrics,uh uh uh uh uh uh uh uh day night toss turn keep stressing mind mind look peace see attain need keep silly game play game play look madness magnet keep attracting try run see fast think first surely finish last finish last 'cause day night lonely stoner seems free mind night alone thing never change lonely loner seems free mind night night night hold phone lonely stoner mr. solo doe low move ca seem shake shade within dream see life made made pain deep silent sleeper wo hear peep peep girl want seem want seems feeling 'cause day night lonely stoner seems free mind night alone day night lonely loner seems free mind night day night lonely stoner seems free mind night alone thing never change lonely loner seems free mind night day night lonely stoner seems free mind night alone thing never change lonely loner seems free mind night night night night night
29,"""Party in the U.S.A.""",Miley Cyrus,https://genius.com/Miley-cyrus-party-in-the-usa-lyrics,hopped plane lax dream cardigan welcome land fame excess gon na fit jumped cab first time look right see hollywood sign crazy everybody seems famous tummy turnin feelin kinda homesick much pressure nervous taxi man turned radio jay-z song jay-z song jay-z song put hand playin song butterfly fly away noddin head like yeah movin hip like yeah got hand playin song know gon na okay yeah party u.s.a. yeah party u.s.a. get club taxi cab everybody lookin like chick rockin kick got ta town hard girl around definitely nashville party 'cause see stiletto guess never got memo tummy turnin feelin kinda homesick much pressure nervous dj dropped favorite tune britney song britney song britney song put hand playin song butterfly fly away noddin head like yeah movin hip like yeah got hand playin song know gon na okay yeah party u.s.a. yeah party u.s.a. feel like hopping flight back hometown tonight something stop every time dj play song feel alright put hand playin song butterfly fly away noddin head like yeah movin hip like yeah got hand playin song know gon na okay yeah party u.s.a. yeah party u.s.a. put hand playin song butterfly fly away noddin head like yeah movin hip like yeah got hand playin song know gon na okay yeah party u.s.a. yeah party u.s.a
30,"""Don't Trust Me""",3OH!3,https://genius.com/3oh-3-dont-trust-me-lyrics,verse 1 sean foreman nathaniel motte black dress tights underneath got breath last cigarette teeth actress actress got need got money parent trust fund back east t-t-t-tongues always pressed cheek tongue inside girl teeth tell boyfriend boyfriend say got beef vegetarian fucking scared want touch woah-oh want love woah-oh never leave woah-oh woah-oh oh-oh trust ho never trust ho wo trust ho 'cause ho wo trust want touch woah-oh want love woah-oh never leave woah-oh woah-oh oh-oh trust ho never trust ho wo trust ho 'cause ho wo trust verse 2 sean foreman nathaniel motte x back hand washed bathroom drink like band setlist setlist stole stage red purple lipstick page br-br-br-bruises cover arm shaking finger bottle palm best best one know another girl alone bar want touch woah-oh want love woah-oh never leave woah-oh woah-oh oh-oh trust ho never trust ho wo trust ho 'cause ho wo trust want touch woah-oh want love woah-oh never leave woah-oh woah-oh oh-oh trust ho never trust ho wo trust ho 'cause ho wo trust shush girl shut lip helen keller talk hip said shush girl shut lip helen keller talk hip said shush girl shut lip helen keller talk h— want touch woah-oh want love woah-oh never leave woah-oh woah-oh oh-oh trust ho never trust ho wo trust ho 'cause ho wo trust want touch woah-oh want love woah-oh never leave woah-oh woah-oh oh-oh trust ho never trust ho wo trust ho 'cause ho wo trust
31,"""Run This Town""",Jay-Z featuring Rihanna and Kanye West,https://genius.com/Jay-z-run-this-town-lyrics,intro rihanna jay z feel comin air yeah hear scream everywhere yeah addicted thrill ready dangerous love affair come ca scared go got problem tell thing mind gon run town tonight ah gon run town tonight yeah yeah gon run town yeah said roc nation pledge allegiance get fatigue black everything black card black car black everything girl blackbird ridin dillingers get depth boy really real enough la familia explain later let get back paper couple band tryin get back gave doug grip lost flip five stack yeah talkin 5 comma 6 zero dot zero doug back runnin circle round nigga squared hold chorus rihanna jay z life game fair yeah break rule care uh-huh keep doin thang walkin tall rain victory within mile almost give thing mind gon run town tonight uh yeah hey hey hey hey gon run town tonight yeah said call caesar dark caesar please follow leader eric b microphone fiend return god peace god ah ah nobody fresher maison ah martin margiela table screamin fuck side jealous got banquette full broad got table full fella yeah spendin cake throw hand 'cause got spade yeah whole team got dough banquette lookin like millionaire row life game fair break rule care keep doin thang walkin tall rain victory within mile almost give thing mind gon run town tonight hey hey hey hey gon run town tonight verse 3 kanye west jay-z crazy go bein joe blow everybody dick homo bought whole family whip volvos next time church please photo police escort everybody passport life everybody ask fast life crash course think rap push fuckin rav4 know stay stunting girl gon want one thing spend whole life good hunting good gon come good cumming got as swallow g-string top uh two bee sting beasting riesling nigga made precinct give damn drama dude bring tryin change color mood ring reebok baby need try new thing ever shoe without shoe string ye baby heel may— baby wheel trippin sippin refill feelin like runnin huh know feel outro jay z rihanna hey hey yeah yeah hey hey hey hey hey gon run town tonight
32,"""Let It Rock""",Kevin Rudolf featuring Lil Wayne,https://genius.com/Kevin-rudolf-let-it-rock-lyrics,let rock let rock let rock see dirty face hide behind collar done vain truth hard swallow pray god justify way live lie live lie live lie take time crime well made bed made mine arrive bring fire make come alive take higher saint forgot must remind let rock let rock let rock son disgraced knew father cursed name turned chased dollar broke heart stuck middle finger world world world take time stand line well get got mine arrive bring fire make come alive take higher saint forgot must remind let rock let rock let rock verse 3 lil wayne kevin rudolf yeoaw wayne world planet rock panty drop top gon na rock 'til camera stop sing angel like angela rock pamela rock samantha rock amanda tamara ménage à moi like bitch mechanic fix dick dick shorty go wherever pick town jewelry louder engine sound big-ass rock like ground dirty like sock ground weezy arrive bring fire make come alive take higher forgot must remind let rock let rock let rock arrive bring fire make come alive take higher saint forgot must remind let rock let rock let rock let rock let rock let rock let rock let rock back like forgot somethin somethin ruling rock rubbin rap running mile like trying get flat stomach like wayne personal trainer aim perfect bang ya period like reminder wish could cruel wish could say thing ca wo live lie time
33,"""Fire Burning""",Sean Kingston,https://genius.com/Sean-kingston-fire-burning-lyrics,somebody call 9-1-1 shawty fire burning dance floor whoa guann kingston let go hey redone hey hey shawty got super thang hotter sun south spain got soon walked door oh pocket started tickling way dropped low thang got wan na spend money get pop lock drop birthday cake got candle need blow crazy flame away take red black card jewelry shawty cool like fire cool like fire somebody call 9-1-1 shawty fire burning dance floor whoa got ta cool gon bring roof ground dance floor whoa fire burning fire burning dance floor little shawty fire burning dance floor fire burning fire burning dance floor little shawty fire burning dance floor body masterpiece order one every hundred year doubt takin home home afraid blow leg little mama game change cover world world get pop lock drop birthday cake got candle need blow crazy flame away take red black card jewelry shawty cool like fire cool like fire somebody call 9-1-1 shawty fire burning dance floor whoa got ta cool bring roof ground dance floor whoa fire burning fire burning dance floor little shawty fire burning dance floor fire burning fire burning dance floor little shawty fire burning dance floor got fire dance make fella run around exit dance floor boy want got fire dance make fella run around exit dance floor boy want get pop lock drop birthday cake got candle need blow crazy flame away take red black card jewelry shawty cool like fire cool like fire somebody call 9-1-1 shawty fire burning dance floor whoa got ta cool bring roof ground dance floor whoa fire burning fire burning dance floor little shawty fire burning dance floor fire burning fire burning dance floor little shawty fire burning dance floor somebody call 9-1-1
