No.,Title,Artist,Lyrics_URL,Lyrics
68,"""Fallin' for You""",Colbie Caillat,https://genius.com/Colbie-caillat-fallin-for-you-lyrics,know think may fallin droppin quickly maybe keep wait know better trying tell want scared say hiding feeling tired holding inside head spending time thinking 'bout know think fallin waiting life found know think fallin fallin standing hold hand pull towards start dance around u see nobody silence trying tell want scared say hiding feeling tired holding inside head spending time thinking 'bout know think fallin waiting life found know think fallin fallin oh ca take heart racing emotion keep spinning spending time thinking 'bout know think fallin waiting life found know think fallin fallin think fallin ca stop thinking 'bout want around ca hide think fallin ca stop thinking 'bout want around ca hide think fallin fallin oh-oh oh oh-oh oh-oh oh fallin
69,"""Untouched""",The Veronicas,https://genius.com/The-veronicas-untouched-lyrics,verse 1 jessica lisa go ooh-ooh go ah ah la-la-la-la a-la-la-la ca lie lie lie lie lie lie wan na wan na wan na get get get want stop gim gim gim got got 'cause ca wait wait wait anymore even talk consequence 'cause right thing making sense give damn say think think 'cause one mind never ever let leave try stop time forever never wan na hear say goodbye feel untouched want much ca resist enough say miss feel untouched right need much somehow ca forget going crazy moment met need much verse 2 lisa jessica see breathe want a-la-la-la a-la-la-la take take take take take time time live live way got ta got ta live life gim gim gim scared see loneliness wanting even think right wrong wrong right 'cause end one else gon na around answer question left behind meant even world fall today still got hold never let feel untouched want much ca resist enough say miss feel untouched right need much somehow ca forget going crazy moment met untouched un- untouched untouched un- untouched untouched un- a-la-la-la a-la-la-la a-la-la-la a-la-la-la feel untouched want much ca resist enough say miss feel untouched right need much somehow ca forget going crazy moment met feel untouched want much ca resist enough say miss feel untouched right need much somehow ca forget going crazy moment met untouched un- untouched untouched un-
70,"""If Today Was Your Last Day""",Nickelback,https://genius.com/Nickelback-if-today-was-your-last-day-lyrics,best friend gave best advice said day gift given right leave stone unturned leave fear behind try take path less traveled first step take longest stride today last day tomorrow late could say goodbye yesterday would live moment like last leave old picture past donate every dime today last day grain way life worth prize always worth fight every second count 'cause second try live like never live twice take free ride life today last day tomorrow late could say goodbye yesterday would live moment like last leave old picture past donate every dime would call old friend never see reminisce old memory would forgive enemy would find one dreamin swear god finally fall love today last day today last day would make mark mending broken heart know never late shoot star regardless whatever take 'cause ca rewind moment life let nothin stand way 'cause hand time never side today last day tomorrow late could say goodbye yesterday would live moment like last leave old picture past donate every dime would call old friend never see reminisce old memory would forgive enemy would find one dreamin swear god finally fall love today last day
71,"""Throw It in the Bag""",Fabolous featuring The-Dream,https://genius.com/Fabolous-throw-it-in-the-bag-lyrics,intro fabolous dream already know got another one boy a-t-l yeah throw bag brooklyn son fabo aye man got black amex a.k.a throw bag card radio killa know staring girl yeah know staring girl nigga know call hollering girl know call hollering girl keep louboutin louis vuitton gucci foot yup like one one fuck price tag throw bag chorus the-dream fabolous uh huh uh huh uh huh lady ready go shopping throw bag neiman marcus uh huh uh huh uh huh throw bag look price tag heard a-t-l a-t-l ask baby gal treat lady well nothing so-so know j.d well couple benzes black white gray c.l got nigga looking like miss mercedes sale wonder know pay well keep gucci louis labi-el way feel -- must nice man right man got ta price scan ask much look like son brooklyn -- look like get cause got got get miami say stop get get mami speedy daddy duffle bag full chip talking ruffle uh-huh uh-huh uh-huh throw bag uh-huh uh-huh uh-huh throw bag uh-huh uh-huh uh-huh throw bag uh-huh uh-huh uh-huh throw bag verse 3 fabolous the-dream see know i'ma tell thing bank robber told teller throw bag way supposed real nigga 'posed help grocery throw bag paper plastic safer ask dead nigga pay casket remy mar got spitting plenty bar broke as nigga could buy mini bar get loso got know gentleman dozen bottle rose mo oh got man well need richer one meet parking lot plate say get u 1 meet register regular nigga price checking help second proceed give need like breaking weed shorty throw bag uh-huh uh-huh uh-huh throw bag uh-huh uh-huh uh-huh throw bag everybody throw bag hey throw bag everybody throw bag hey throw bag everybody throw bag hey throw bag everybody throw bag hey throw bag uh-huh uh-huh uh-huh throw bag uh-huh uh-huh uh-huh throw bag uh-huh uh-huh uh-huh throw bag uh-huh uh-huh uh-huh throw bag
72,"""Love Drunk""",Boys Like Girls,https://genius.com/Boys-like-girls-love-drunk-lyrics,hey hey hey hey top summer sun day met like hit-and-run still taste tongue sky burning like firework made want oh bad hurt girl case heard used love drunk hungover love forever forever used kiss night bar fight call cryin say hello goodbye 'cause one sip would make sick used love drunk hungover love forever hey hey hey hey hey hey hey hey hot sweat blurry eye spinnin 'round roller coaster ride world stuck black white drove crazy every time touched broken ca get oh girl make lush used love drunk hungover love forever forever used kiss night bar fight call cryin say hello goodbye 'cause one sip would make sick used love drunk hungover love forever time wasted bullshit put checkin rehab 'cause everything mean thing used love drunk hungover love forever sober used love drunk hungover love forever forever used kiss night bar fight call cryin say hello goodbye 'cause one sip would make sick used love drunk hungover love forever still taste tongue
73,"""I Love College""",Asher Roth,https://genius.com/Asher-roth-i-love-college-lyrics,nice right man i-i feel good drink would please put air party last night awfully crazy wish taped danced as one girl completely naked drink beer smoke weed good friend need pas three wake ten go eat man love college wan na go college rest life sip banker club drink miller lite thirsty thursday tuesday night ice get pizza dollar slice fill cup let get fucked next table want champion beer pong allen iverson hakeem olajuwon even bounce house better hope make otherwise naked time wasted getting wasted woke today could say um party last night awfully crazy wish taped danced as one girl completely naked drink beer smoke weed good friend need pas three wake ten go eat man love college love drinking love woman man love college ca tell learned school could tell story two um yeah course learned rule like pas shoe leave house 'till booze gone sex gone come condom put two tomorrow night find new jawn hold beer bong nothing wrong fun even get little bit drunk time wasted getting wasted woke today could say party last night awfully crazy wish taped danced as one girl completely naked drink beer smoke weed good friend need pas three wake ten go eat man love college love drinking love woman love college everybody would please put drink high high repeat chug chug chug chug chug chug chug chug freshman freshman freshman freshman something crazy something crazy something crazy something crazy keg-stand keg-stand keg-stand keg-stand man love college love goodnight everybody got ta head back class little bit party last night awfully crazy wish taped danced as one girl completely naked drink beer smoke weed good friend need pas three wake ten go eat man love college really graduate stay rest life know goin house 3 keg see invited bring friend bring mom really graduate stay rest life
74,"""If U Seek Amy""",Britney Spears,https://genius.com/Britney-spears-if-u-seek-amy-lyrics,la la la la la-la la la la la la la la-la la la la la la la la-la la la la la la la la-la la la oh baby baby seen amy tonight bathroom smoking outside oh oh baby baby take piece lime drink i'ma buy know like oh oh oh tell seen 'cause oh ca get brain wan na go party gon go somebody take home ha-ha hee-hee ha-ha ho love hate say want boy girl begging seek amy love hate ca see see boy girl begging seek amy love hate la la la la la-la la la la la la la la-la la la amy told gon na meet know closing club oh seen twice know face hard see people standing way oh oh oh tell seen 'cause oh ca get brain wan na go party gon go somebody take home ha-ha hee-hee ha-ha ho love hate say want boy girl begging seek amy love hate ca see see boy girl begging seek amy oh say want oh ca see see yeah say want tell see let know wearing like 'cause waiting forever let know going mind oh baby baby seek amy tonight oh oh baby baby whatever like oh baby baby baby oh baby baby baby la la la la la-la la la la la la la la-la la la la la la la la-la la la la la la la la-la la la love hate say want boy girl begging seek amy love hate ca see see boy girl begging seek amy love hate say want love hate ca see see boy girl begging seek amy oh say want oh ca see see yeah say want boy girl begging seek amy
75,"""Big Green Tractor""",Jason Aldean,https://genius.com/Jason-aldean-big-green-tractor-lyrics,shiny little beamer ragtop sittin drive would get dog barkin a-waggin around laughed said y'all get new dress curled hair lookin good go somewhere said want baby care go show stay right take ride big green tractor go slow make go faster wood pasture long really matter climb lap drive want girl know got hold go town baby rather take ride big green tractor said fire show around sit hill watch sun go firefly dancin moon come turn light head back house take another ride big green tractor go slow make go faster wood pasture long really matter climb lap drive want girl know got hold go town baby rather take ride big green tractor let dust seat mhm put pretty little arm around hell yeah girl climb lap drive want girl know got hold go town baby rather take ride big green tractor oh yeah go town go another round big green tractor
76,"""White Horse""",Taylor Swift,https://genius.com/Taylor-swift-white-horse-lyrics,say sorry face angel come need paced back forth time 'cause honestly believed holdin day drag stupid girl shoulda known shoulda known princess fairytale one sweep foot lead stairwell hollywood small town dreamer went let late white horse come around maybe naive got lost eye never really chance mistake know love fight upper hand many dream happy ending know princess fairytale one sweep foot lead stairwell hollywood small town dreamer went let late white horse come around knee beggin forgiveness beggin like always wanted sorry 'cause princess fairytale gon na find someone someday might actually treat well big world small town rear view mirror disappearing late white horse late white horse catch oh whoa whoa whoa try catch oh late catch
77,"""Disturbia""",Rihanna,https://genius.com/Rihanna-disturbia-lyrics,bum bum be-dum bum bum be-dum bum bum bum be-dum bum bum be-dum bum bum bum be-dum bum bum be-dum bum bum bum be-dum bum bum be-dum bum gas red nothin heard nothin said life head feel like goin insane yeah thief night come grab creep inside consume disease mind control close comfort ah put brake light city wonder gon play nice watch might go better think twice train thought altered must falter wise mind disturbia like darkness light disturbia scarin tonight mind disturbia used like disturbia disturbia bum bum be-dum bum bum be-dum bum bum bum be-dum bum bum be-dum bum bum bum be-dum bum bum be-dum bum bum bum be-dum bum bum be-dum bum faded picture wall disconnected one call got ta get figure close comfort oh thief night come grab creep inside consume disease mind control feel like monster oh put brake light city wonder gon play nice watch might go better think twice train thought altered must falter wise mind disturbia like darkness light disturbia scarin tonight disturbia used like disturbia disturbia bum bum be-dum bum bum be-dum bum bum bum be-dum bum bum be-dum bum bum bum be-dum bum bum be-dum bum bum bum be-dum bum bum be-dum bum release curse tryin remain tame strugglin ca go oh-oh-oh-oh-oh think gon na ah-ah-ah-ah-ah put brake light city wonder gon play nice watch might go better think twice train thought altered must falter wise mind disturbia like darkness light disturbia scarin tonight disturbia used like disturbia disturbia bum bum be-dum bum bum be-dum bum bum bum be-dum bum bum be-dum bum bum bum be-dum bum bum be-dum bum bum bum be-dum bum bum be-dum bum
78,"""21 Guns""",Green Day,https://genius.com/Green-day-21-guns-lyrics,know worth fightin worth dyin take breath away feel suffocatin pain weigh pride look place hide someone break heart inside ruin one twenty-one gun lay arm give fight one twenty-one gun throw arm sky end road lost sense control thought taken toll mind break spirit soul faith walk broken glass hangover pas nothing ever built last ruin one twenty-one gun lay arm give fight one twenty-one gun throw arm sky try live burned house home stand close fire like liar looking forgiveness stone time live let die ca get another try somethin inside heart died ruin one twenty-one gun lay arm give fight one twenty-one gun throw arm sky one twenty-one gun lay arm give fight one twenty-one gun throw arm sky
79,"""Turn My Swag On""",Soulja Boy Tell 'Em,https://genius.com/Sad-frosty-and-dc-the-don-wet-wet-another-page-for-sexting-lyrics,astro beat nigga woke fresh bed watch turn swag like souljaboy tell em brodie bought brand new drop somebody gon die today yes bro pulled brand new semi talk neck gon send whitney pissed yesterday bitch kept calling phone tryna make mad shit imma rockstar 2020 gem whole lotta cash make mistake racing lil bro said 200 mile dash bro night stu made 22 song shit gas know dad dad ha know mad mad gon run house front door locked okay gon go back wild boy still smoking thrax got beam back get back lil nigga duck duck quack name daij hold relax big kick know lit want smoke teezo empty clip internet talking ca believe think phase extended clip rifle got big gun like navy shorty pulled served crank ion mean drug let hit back squad full pussy like chilling cat fuck corona virus kill bat drop top lincoln like john f. kennedy baby let cuff pick infiniti take movie recreate human centipede bring home 9 want parent enemy
80,"""Rockin' That Thang""",The-Dream,https://genius.com/The-dream-rockin-that-thang-single-version-lyrics,girl love baby want know hooked body trying radio killa definition fine told body look better mine like way rock hip rockin hip told take like rocket ship straight jacket jean look crazy em way rockin thought jay z denim let drop jewel ya put roc air call nana cause got rockin chair go back forth- forth back patron yak cnt get fact mac goldie prolly would would trick sick money cough stack sneeze g baby let roll rockin shit like way rockin club swear gon na make nigga fall love rockin shit like way rockin club nothing say rockin shit like whoa whoa look shorty roll roll rockin shit like look shorty go go rockin beat rockin think rockin sleep face like model body shape like bottle girl wan na hit wan na hit lotto revvin got hand throttle wan na get top zoom yamaha call switchin gear zoom inside taste look try swallow call mr. shoe- shine baby polish ya leave ya spit clean dnt use polisher demolition man tell friend demolish ya plus nigga baby could make popular get another shot ciroc ya cause gon rockin ya treat like first ladt put barack ya rockin shit like way rockin club swear gon na make nigga fall love rockin shit like way rockin club nothing say rockin shit like fresh black president one air force one air force one dream sorry reality see rockin shit complementing salary complementary balance told em tally spinning like ballet touched budget ballot see girl holla told know classify case rockin shit like way rockin club swear gon na make nigga fall love rockin shit like way rockin club nothing say rockin shit like let take place far beyond whole nother galaxy travel mind explore sexuality melt imagination mold reality heart art gallery girl feel picture painted cause related like mother son none overrated others one destiny make got ta thank sharing world real inspiration reason thinking incapable taking duty making interchangable thought sensational perfect bliss ready take milky way hershey kiss know tongue got battery bedroom lose calorie start family dnt worry cause situation control let dive heart swim around soul take shorty rock left rock right lend body rock nite tell nigga hollaback tell girl goodnite way rockin club swear gon na make nigga fall love
81,"""Chicken Fried""",Zac Brown Band,https://genius.com/Zac-brown-band-chicken-fried-lyrics,know like chicken fried cold beer friday night pair jean fit right radio well raised beneath shade georgia pine home know sweet tea pecan pie homemade wine peach grow house much talk filled love grown southern ground little bit chicken fried cold beer friday night pair jean fit right radio well seen sun rise see love woman eye feel touch precious child know mother love funny little thing life mean live drive price tag clothes dollar sign piece mind come know agree drink raise glass toast little bit chicken fried cold beer friday night pair jean fit right radio well seen sun rise see love woman eye feel touch precious child know mother love thank god life star stripe may freedom forever fly let ring salute one died one give life sacrifice thing love like chicken fried cold beer friday night pair jean fit right radio well seen sun rise see love woman eye feel touch precious child know mother love get little chicken fried cold beer friday night pair jean fit right radio well done seen sun rise see love woman eye feel touch precious child know mother love
82,"""Diva""",Beyoncé,https://genius.com/Beyonce-diva-lyrics,diva diva diva diva diva diva diva div— na-na-na diva female version hustla hustla hustla na-na-na diva female version hustla hustla hustla stop track let state fact told give minute right back fifty million 'round world say could get done got sick filthy benjis ca spend gon talkin shit act like got number one diva game minute know read paper one call queen every radio 'round world know 'cause diva diva diva diva diva diva diva div— na-na-na diva female version hustla hustla hustla na-na-na diva female version hustla hustla hustla pull wan na pop hood bet better six-pack cooler gettin money diva gettin money gettin money got nothin tell somethin yo bos lady like talk back wan na see like meet ya say diva na-na-na diva female version hustla hustla hustla na-na-na diva female version hustla hustla hustla since 15 stiletto struttin game yo age question ask hit stage diva best believe see gettin paid callin greet need bed made stick-up stick-up need bag money gon na stick-up stick-up see ask money lady get see take another level passenger plane diva diva diva diva stick-up stick-up need bag money diva diva stick-up stick-up see mask money diva div— na-na-na diva female version hustla hustla hustla na-na-na diva female version hustla hustla hustla diva diva diva diva diva diva diva diva diva diva diva diva diva diva diva diva
83,"""Replay""",Iyaz,https://genius.com/Iyaz-replay-lyrics,shawty like melody head ca keep got singing like​ na-na-na-na every day like ipod stuck replay replay-ay-ay-ay shawty like melody head ca keep got singing like na-na-na-na every day like ipod stuck replay j-j-j-jr replay remember first time met mall friend scared approach ya came closer hoping would give chance would ever knew would ever friend real worldwide breaking rule like song played like something poster dime say gun holster running mind day ayy shawty like melody head ca keep got singing like​ na-na-na-na every day like ipod stuck replay replay-ay-ay-ay shawty like melody head ca keep got singing like na-na-na-na every day like ipod stuck replay replay-ay-ay-ay see around globe leave mind talk phone night 'til morn girl really changed life doin thing never kitchen cooking thing like real worldwide breaking rule someday wan na make wife like something poster dime say gun holster running mind day ayy shawty like melody head ca keep got singing like na-na-na-na every day like ipod stuck replay replay-ay-ay-ay shawty like melody head ca keep got singing like na-na-na-na everyday like ipod stuck replay replay-ay-ay-ay melody oh girl could write symphony one could fill fantasy come baby girl let sing ayy melody oh girl could write symphony one could fill fantasy come baby girl let sing ayy na na-na na-na na-na na-na na-na na-naa shawty got singing na na-na na-na na-na na-na na-na na-naa got singing shawty like melody head ca keep got singing like na-na-na-na every day like ipod stuck replay replay-ay-ay-ay shawty like melody head ca keep got singing like na-na-na-na every day like ipod stuck replay replay-ay-ay-ay
84,"""Then""",Brad Paisley,https://genius.com/Brad-paisley-then-lyrics,remember trying stare night first met mesmerized three week later front porch light taking 45 minute kiss goodnight told yet thought loved whole life whole world ca believe way feel girl like river meet sea stronger ever come far since day thought loved remember taking back right first met surprised people around care got one knee right thought loved whole life whole world ca believe way feel girl like river meet sea stronger ever come far since day thought loved see baby way see hair turning grey ca see ever going love said whole life whole world ca believe way feel girl look back someday moment look say thought loved thought loved ooo ooo ooo ooo ooo ooo ooo ooo ooo ooo ooo ooo ooo ooo ooo ooo ooo ooo ooo ooo
85,"""Her Diamonds""",Rob Thomas,https://genius.com/Rob-thomas-her-diamonds-lyrics,oh hell say ca win losin lay back man many time know doin like know light moon rub eye say funny night make blind imagine know supposed feel bad let say ooh ca take tear like diamond floor diamond bring 'cause ca help tried best ca win hard see ground diamond fallin way well sits stare distance take night know could break concentration oh feel right 'til light moon rub eye sits bed start cry something less know supposed sit cry let see say ooh ca take tear like diamond floor diamond bring 'cause ca help tried best ca win hard see ground diamond fallin shuts night try close eye find daylight right right tonight say ooh ca take tear like diamond floor diamond bring 'cause ca help tried best ca win hard see ground diamond fallin ooh ca take tear like diamond floor diamond bring 'cause ca help tried best ca win hard see ground diamond fallin diamond fallin diamond fallin yeah diamond fallin diamond fallin ca take diamond fallin
86,"""How Do You Sleep?""",Jesse McCartney featuring Ludacris,https://genius.com/Jesse-mccartney-how-do-you-sleep-lyrics,oh-oh oh-oh oh-oh oh-oh oh-oh oh-oh oh-oh oh-oh year seen heard missing crazy sleep found letter wrote still smell like damn sweet memory sleep tried best movin yet find girl like see thing wishing time stay awake knowing think thing thought never happen could see way come getcha girl favorite car missing top remember 'round way used park thing steal heart year seen heard missing crazy sleep found letter wrote still smell like damn sweet memory sleep year seen heard missing crazy sleep found letter wrote still smell like damn sweet memory sleep baby hear friend say saw girl game damn got ta say big mistake body bang miss conversation tell gettin sleep ca think ca eat 'til come see way come getcha girl favorite car missing top remember 'round way used park thing steal heart year seen heard missing crazy sleep found letter wrote still smell like damn sweet memory sleep oh-oh oh-oh oh-oh oh-oh oh-oh oh-oh oh-oh oh-oh year seen heard missing crazy sleep found letter wrote still smell like damn sweet memory sleep year seen heard missing crazy sleep found letter wrote still smell like damn sweet memory sleep oh-oh oh-oh oh-oh oh-oh
87,"""3""",Britney Spears,https://genius.com/Britney-spears-3-lyrics,one two three got one-eighty degree caught countin one two three peter paul mary getting 3p everybody loves— oh countin one two one-one-one-one two three countin one two countin one-one two three babe pick night come play alright say merrier triple fun way twister floor say living sin new thing yeah countin one two three got one-eighty degree caught countin one two three peter paul mary getting 3p everybody loves— oh countin one two three got one-eighty degree caught countin one two three peter paul mary getting 3p everybody love — oh three charm two see harm game let make team make say name loving extreme game living sin new thing yeah countin one two three got one-eighty degree caught countin one two three peter paul mary getting 3p everybody loves— oh countin one two three got one-eighty degree caught countin one two three peter paul mary getting 3p everybody love — oh innocent fun nothing meant like company let three four floor one two three got one-eighty degree caught countin one two three peter paul mary getting 3p everybody loves— oh countin one two three got one-eighty degree caught countin one two three peter paul mary getting 3p everybody love — oh
