No.,Title,Artist,Lyrics_URL,Lyrics
34,"""Whatcha Say""",Jason Derulo,https://genius.com/Jason-derulo-whatcha-say-lyrics,intro imogen heap j.r. rotem wha-wha-wha-wha-what say j-j-j-j-j.r. chorus imogen heap jason derulo mm whatcha say oh meant well well course mm whatcha say jason derulo mm best course wrong long tryna please girl caught lust really want one else know shoulda treated better meant last forever let give another chance really man 'cause roof caved truth came know become star livin large anything tell girl chorus imogen heap jason derulo mm whatcha say oh meant well well course mm whatcha say oh whatcha say whatcha say mm best course mm whatcha say oh meant well well course mm whatcha say oh whatcha say whatcha say wha-wha-wha-wha-what say could live knowin let love go ooh one chance got ta let know know clever meant together let give another chance really man 'cause roof caved truth came know become star livin large anything tell girl chorus imogen heap jason derulo mm whatcha say oh meant well well course mm whatcha say oh whatcha say whatcha say mm best course mm whatcha say oh meant well well course mm whatcha say oh whatcha say whatcha say wha-wha-wha-wha-what say bridge jason derulo imogen heap girl tell say want leave though caught cheatin tell tell say really need life 'cause thing right girl tell tell say want leave though caught cheatin tell tell say really need life 'cause thing right oh-oh-ohh pre-chorus jason derulo imogen heap 'cause roof caved truth came know know mm become star livin large anything baby say chorus imogen heap jason derulo mm whatcha say oh meant well well course well course baby mm whatcha say oh whatcha say whatcha say ohh mm best course oh well course mm whatcha say oh meant well say well course woah oh oh mm whatcha say oh whatcha say whatcha say wha-wha-wha-wha-what say beluga height
35,"""LoveGame""",Lady Gaga,https://genius.com/Lady-gaga-lovegame-lyrics,let fun beat sick wan na take ride disco stick let fun beat sick wan na take ride disco stick huh huh wan na kiss might miss babe complicated stupid got as squeezed sexy cupid guess want play want play love game love game hold love wan na touch minute maybe three second enough heart quit let fun beat sick wan na take ride disco stick think much bust kick wan na take ride disco stick let play love game play love game want love want fame game dans love game let play love game play love game want love want fame game dans love game huh huh mission involves heavy touching yeah indicated interest educated sex yes want bad want bad love game love game hold love wan na touch minute maybe three second enough heart quit let fun beat sick wan na take ride disco stick think much bust kick wan na take ride disco stick let play love game play love game want love want fame game dans love game let play love game play love game want love want fame game dans love game huh huh see staring across block smile mouth hand story u always start boy girl huh game game game game love game let play love game play love game want love want fame game dans love game let play love game play love game want love want fame game dans love game let play love game play love game want love want fame game dans love game let play love game play love game want love want fame game dans love game huh dans love game huh
36,"""Waking Up in Vegas""",Katy Perry,https://genius.com/Katy-perry-waking-up-in-vegas-lyrics,got ta help blur last night need taxi 'cause hungover broke lost fake id lost motel key spare freakin dirty look blame wan na cash get hell outta town baby remember told shut put money mouth get wakin vega get shake glitter clothes get wakin vega light bright get hitched last night dressed like elvis wearing class ring call mother 'cause partner crime baby remember told shut put money mouth get wakin vega get shake glitter clothes get wakin vega got information overload situation lost control send so ha get cash gon na tear town baby remember told remember told remember told told told oh yeah shut put money mouth get wakin vega get shake glitter clothes get wakin vega get baby shake glitter shake shake shake glitter give cash baby give cash baby
37,"""Birthday Sex""",Jeremih,https://genius.com/Jeremih-birthday-sex-lyrics,yeah yeah yeah yo birthday know want ri-i-ide even go my-y-y house sip mo easy sit my-y-y couch feel good know want cry-y-y say want passion think found get ready action astounded switchin position feel surrounded tell want gift girl girl know i-i-i girl know i-i-i fiendin wake late-night dreamin lovin girl girl know i-i-i girl know i-i-i need candle cake need yo body make ooh birthday sex birthday sex birthday sex birthday sex see sexy jean got tent one two three think got pinned tap fight end ring bell gon start grindin passion 'cause yo birthday hour know thirsty kiss sweetly taste like hershey tell want gift girl girl know i-i-i girl know i-i-i fiendin wake late-night dreamin lovin girl girl know i-i-i girl know i-i-i need candle cake need yo body make ooh birthday sex birthday sex birthday sex birthday sex first gon na take dive water deep know pleased body body ah-ooh girl without broom might sweep foot make wan na tell somebody body maybe float top waterbed close eye improv yo leg work way kitchen stove table girl know able please yeah say wanted flower bed got hour bed girl know i-i-i girl know i-i-i fiendin wake late-night dreamin 'bout lovin girl girl know i-i-i girl know i-i-i need candle cake need yo body make ooh birthday sex birthday sex birthday sex birthday sex
38,"""Sober""",Pink,https://genius.com/P-nk-sober-lyrics,wan na girl laugh loudest girl never want alone wan na call four o'clock morning 'cause one know world wo home ah sun blinding stayed oh finding way want story end safe high nothing touch feel party pain inside protection feel good sober wan na girl fill silence quiet scare 'cause scream truth please tell conversation 'cause wo remember save breath 'cause use ah night calling whisper softly come play falling let go one blame safe high nothing touch feel party pain inside like perfection feel good sober comin comin comin spinning 'round spinning 'round spinning 'round looking sober comin comin comin spinning 'round spinning 'round spinning 'round looking sober good good good 'til go bad 'til tryin find heard cry never broken agony tryin find friend oh oh safe high nothing touch feel party pain inside like perfection feel good sober safe high nothing touch feel party pain inside like perfection feel good sober
39,"""Womanizer""",Britney Spears,https://genius.com/Britney-spears-womanizer-lyrics,superstar goin know got clue doin play brand new chick know baby look gettin re-up baby got puppet string fakin like good one call 'em like see 'em know baby womanizer woman-womanizer womanizer oh womanizer oh womanizer baby you-you you-you womanizer womanizer womanizer womanizer boy try front i-i know a-are boy try front i-i know a-are got goin oh-so-charmin ca womanizer boy try front i-i know a-are boy try front i-i know a-are say crazy got crazy nothin womanizer daddy-o got swagger champion bad ca find right companion guess one many make hard could easy baby lollipop must mistake sucker think would victim another say play wan na way never gon na fall never baby womanizer woman-womanizer womanizer oh womanizer oh womanizer baby you-you you-you womanizer womanizer womanizer womanizer womanizer womanizer boy try front i-i know a-are boy try front i-i know a-are got goin oh-so-charmin ca womanizer boy try front i-i know a-are boy try front i-i know a-are say crazy got crazy nothin womanizer maybe lived different world yeah would good maybe could girl ca 'cause womanizer woman-womanizer womanizer oh womanizer oh womanizer baby you-you you-you womanizer womanizer womanizer womanizer womanizer womanizer boy try front i-i know a-are boy try front i-i know a-are got goin oh-so-charmin ca womanizer boy try front i-i know a-are boy try front i-i know a-are say crazy got crazy nothin womanizer boy try front i-i know a-are boy try front i-i know a-are womanizer woman-womanizer womanizer oh womanizer oh womanizer baby
40,"""Whatever You Like""",T.I.,https://genius.com/Ti-whatever-you-like-lyrics,aye jim know ol sugar daddy trickin tell girl said could whatever like said could whatever like yeah stack deck patron ice pop bottle night baby could whatever like said could whatever like yeah late night sex wet tight gas jet tonight baby could go wherever like said could go wherever like yeah anytime want pick telephone know nothin drop couple stack want could get dear five million dollar home drop bentleys swear yeah want yo body need yo body long got wo need nobody want got go get buy tell broke nigga quiet stack deck patron ice pop bottle night baby could whatever like said could whatever like yeah late night sex wet tight gas jet tonight baby could go wherever like said could go wherever like yeah shawty hottest love way drop brain good swore went college hundred karat deposit vacation tropic ‘ cause e'rybody know trickin got need never ever got ta go yo wallet long got rubberband bank pocket five six ride rim body kit got ta downgrade get get chick could want go store bag want never man like buy anything heart desire like yeah want yo body need yo body long got wo need nobody want got go get buy tell broke nigga quiet stack deck patron ice pop bottle night baby could whatever like said could whatever like yeah late night sex wet tight gas jet tonight baby could go wherever like said could go wherever like yeah talkin big boy ride big boy ice let put big boy yo life fresh look nice let put big boy yo life right want yo body need yo body long got wo need nobody want got go get buy tell broke nigga quiet stack deck patron ice pop bottle night baby could whatever like said could whatever like yeah late night sex wet tight gas jet tonight baby could go wherever like said could go wherever like yeah
41,"""Obsessed""",Mariah Carey,https://genius.com/Mariah-carey-obsessed-lyrics,intro mariah carey the-dream like obsessed oh oh-oh-oh ay ay ay oh oh-oh-oh ay ay ay oh oh-oh-oh real mc please oh oh-oh-oh step mic oh oh-oh-oh mc mc oh oh-oh-oh need mc oh oh-oh-oh place oh oh-oh-oh mc mc blog saying met bar even know saying house saying car la jermaine lame one even mention name must weed must e 'cause popping heard get popping ooh-oh woah obsessed boy wan na know lying sexing everybody know clear upset oh finally found girl could impress last man earth still could get delusional delusional boy losing mind confusing yo confused know wasting time got fired napoleon complex see right like bathing windex oh oh oh boy obsessed oh oh-oh-oh oh oh-oh-oh oh oh-oh-oh oh oh-oh-oh oh oh-oh-oh-oh oh-oh-oh-oh-oh oh oh-oh-oh-oh oh-oh-oh-oh-oh oh oh-oh-oh-oh oh-oh-oh-oh-oh oh oh-oh-oh-oh oh-oh-oh-oh-oh job hating hard gon feed i'ma let starve grasping air ventilation breath hope waiting telling world much miss never tripping mom pop corporation press conference conversation ooh woah woah woah obsessed boy wan na know lying sexing everybody know clear upset oh finally found girl could impress last man earth still could get delusional delusional boy losing mind confusing yo confused know wasting time got fired napoleon complex see right like bathing windex oh oh oh boy obsessed oh oh-oh-oh oh oh-oh-oh oh oh-oh-oh oh oh-oh-oh oh oh-oh-oh-oh oh-oh-oh-oh-oh oh oh-oh-oh-oh oh-oh-oh-oh-oh oh oh-oh-oh-oh oh-oh-oh-oh-oh oh oh-oh-oh-oh oh-oh-oh-oh-oh ooh woah woah woah obsessed boy wan na know lying sexing everybody know clear upset oh finally found girl could impress last man earth still could get delusional delusional boy losing mind confusing yo confused know wasting time got fired napoleon complex see right like bathing windex
42,"""Mad""",Ne-Yo,https://genius.com/Ne-yo-mad-lyrics,woah-oh woah woah-oh woah mmm starin sittin wonderin thinking mmm nobody talkin 'cause talkin turn screamin oh yellin yellin mean neither u listening even worse even remember fighting u mad nothing nothing nothing wo let go nothing nothing nothing love like got oh baby know sometimes gon na rain baby make 'cause ca sleep pain girl wan na go bed want go bed wan na go bed want go bed oh mmm get upset girl constantly accusing oh hey fight war baby u losing oh woah fall place backin backin hell nothing nothing nothing wo let go nothing nothing nothing love like got oh baby know sometimes gon na rain baby make 'cause ca sleep pain girl wan na go bed want go bed wan na go bed want go bed oh oh baby love gon perfect oh good gon na fuss fight long everything alright u go sleep baby gon na happy oh woah woah woah woah oh woah baby know sometimes gon na rain baby make 'cause ca sleep pain girl wan na go bed want go bed wan na go bed want go bed oh
43,"""Good Girls Go Bad""",Cobra Starship featuring Leighton Meester,https://genius.com/Cobra-starship-good-girls-go-bad-lyrics,make good girl go bad make good girl go good girl go bad good girl go bad know type daddy little girl take bite let shake world 'cause one night could wrong gon na make lose control shy 'til drove wild make good girl go bad make good girl go bad hangin corner five best friend heard trouble could resist make good girl go bad make good girl go good girl go bad bad bad good girl go bad good girl go know type boy dangerous yeah guy stupid trust one night could wrong make wan na lose control shy 'til drove wild chorus gabe saporta leighton meester make good girl go bad make good girl go bad hangin corner five best friend heard trouble could resist make good girl go bad make good girl go good girl go bad bad bad good girl go bad good girl go bad bridge gabe saporta leighton meester oh got way boy place treat 'em like stand chance got way girl back actin like hot dance yeah got way boy place treat 'em like stand chance got way girl back actin like hot dance breakdown gabe saporta leighton meester make good girl go bad make good girl go good girl go bad yeah chorus gabe saporta leighton meester hangin corner five best friend heard trouble could resist make good girl go bad make good girl go bad make good girl go good girl go bad bad bad good girl go bad good girl go
44,"""Love Lockdown""",Kanye West,https://genius.com/Kanye-west-love-lockdown-lyrics,loving way wanted run love vibe wrong haunted way home never know never never know never know enough 'til love 'til lose control system overload screaming n-no loving way wanted see wan na move ca escape keep low keep secret code everybody else know keep love lockdown love lockdown keeping love lockdown love lockdown keep love lockdown love lockdown keep love lockdown lose loving way wanted ca keep cool keep true got somethin lose got ta move ca keep still keep keep mind somewhere far home danger zone many time tell 'fore finally got lose lose loving way wanted see go see move wasting time ca wait life racing time finish line keep love lockdown love lockdown keeping love lockdown love lockdown keep love lockdown love lockdown keep love lockdown lose loving way wanted bet one knew got one new know said got love loving way wanted got ta keep going keep loving going keep roll god know baby confused choose choose loving way wanted wan na go need road many time loving way wanted keep love lockdown love lockdown keeping love lockdown love lockdown keep love lockdown love lockdown keep love lockdown lose lose lose lose lose
45,"""So What""",Pink,https://genius.com/P-nk-so-what-lyrics,na-na-na-na-na-na-na na-na-na-na-na-na na-na-na-na-na-na-na na-na-na-na-na-na guess lost husband know went gon na drink money gon na pay rent got brand new attitude gon na wear tonight wan na get trouble wan na start fight na-na-na-na-na-na-na wan na start fight na-na-na-na-na-na-na wan na start fight still rock star got rock move need guess havin fun done gon na show tonight alright fine tool rock star got rock move want tonight uh check flow uh waiter took table gave jessica simp— guess go sit drum boy least know hit song radio somebody gon na die gon na get trouble ex start fight na-na-na-na-na-na-na gon na start fight na-na-na-na-na-na-na gon na get fight still rock star got rock move need guess havin fun done gon na show tonight alright fine tool rock star got rock move want tonight never want fair gave life gave let fall still rock star got rock move need guess havin fun done gon na show tonight alright fine tool rock star got rock move want tonight want tonight gon na show tonight alright fine tool rock star got rock move want tonight woo-hoo ba-da-da-da-da-da
46,"""Hotel Room Service""",Pitbull,https://genius.com/Pitbull-hotel-room-service-lyrics,dj jim jonsin want everybody stop doin know somebody gon na take hotel room tonight make noise meet hotel room meet hotel room meet hotel room meet hotel room forget boyfriend meet hotel room bring girlfriend meet hotel room forget boyfriend meet hotel room bring girlfriend meet hotel room hotel motel holiday inn hotel motel holiday inn hotel motel holiday inn hotel motel holiday inn like freaky stuff two one eye kinky stuff nasty like type like t.i. whatever like bring girl whatever night man left plumber tonight check yo pipe oh healthy type well go egg white gim sweet nasty gucci stuff let tell gon two plus two gon undress gon na go three three gon undress gon na go four four gon freak first forget boyfriend meet hotel room bring girlfriend meet hotel room forget boyfriend meet hotel room bring girlfriend meet hotel room hotel motel holiday inn hotel motel holiday inn hotel motel holiday inn hotel motel holiday inn afterparty hotel lobby room like vroom put finger mouth open blouse pull g-string south ooh okay shawty one company two crowd three party girl got somebody nature naughty gim sweet nasty gucci stuff let tell gon two plus two gon undress gon na go three three gon undress gon na go four four gon freak first forget boyfriend meet hotel room bring girlfriend meet hotel room forget boyfriend meet hotel room bring girlfriend meet hotel room hotel motel holiday inn hotel motel holiday inn hotel motel holiday inn hotel motel holiday inn mujeres jenny oye que bola mujeres yamile oye que bola mujeres roslin oye que bola mujeres zulema oye que bola mujeres cristina oye que bola mujeres carolina oye que bola mujeres sofia oye que bola mujeres estefany oye que bola dale dale dale ...
47,"""Crack a Bottle""","Eminem, Dr. Dre and 50 Cent",https://genius.com/Eminem-dr-dre-and-50-cent-crack-a-bottle-lyrics,intro eminem 50 cent oh lady gentleman moment waiting corner weighing 175 pound record 17 rape 400 assault 4 murder undisputed diabolical villain world slim shady let go crack bottle let body waddle act like snobby model hit lotto oh-oh oh-oh bitch hoppin tahoe got one ridin shotgun one 'em got clothes rubber got rubber noticed many 'em really many u lady love u posse kickin dust 'til break dawn starting party dusk interlude eminem 50 cent okay let go shady haha back andre giant mr. elephant tusk fix musk another one bit dust one mother son got thrown bus kiss butt lick fromunda cheese nut disgust see game way look must redeem name hater get mushed bitch lust man love lay cut fisticuffs lady give eighty-some paper cut picture u ridiculous curse thought 'cause spit verse shit get worse worcestershire sauce could fit word picture perfect work every time every verse every line simple nursery rhyme elementary elephant entered room venture say center attention true mention back vengeance hence signal bat symbol platinum trio back hoe crack bottle let body waddle act like snobby model hit lotto oh-oh oh-oh bitch hoppin tahoe got one ridin shotgun one 'em got clothes rubber got rubber noticed many 'em really many u lady love u posse kickin dust 'til break dawn starting party dusk lady gentleman dr. dre see low rider go like oh got tell sick 'cause know dip six-trey like sick 'em dre itch ca scratch sick hey else say love la 'cause another day one begin last one end pick left get smashed damned fucked around crashed benz drivin 'round smashed front end let cash one grab another one stable monte carlo el camino el dorado hell know want leather seat vinyl decision decision garage look like precision collision maaco beat quake like waco keep bass low speaker away face though crack bottle let body waddle act like snobby model hit lotto oh-oh oh-oh bitch hoppin tahoe got one ridin shotgun one 'em got clothes rubber got rubber noticed many 'em really many u lady love u posse kickin dust 'til break dawn starting party dusk take great pleasure introducing 50 cent bottle bottle money thing party simple ball control like would believe napalm bomb king kong get rolled wrapped reigned calm vietnam ring alarm bring chandon burn marijuan want nigga 'til break get paper man cakin know give fuck spend like mean nothin blow like supposed blown motherfucker grown stunt style flash shit get fuck want trick fat-ass birkin bag classy shit jimmy choo shoe say move bitch move crack bottle let body waddle act like snobby model hit lotto oh-oh oh-oh bitch hoppin tahoe got one ridin shotgun one 'em got clothes rubber got rubber noticed many 'em really many u lady love u posse kickin dust 'til break dawn starting party dusk
48,"""If I Were a Boy""",Beyoncé,https://genius.com/Beyonce-if-i-were-a-boy-lyrics,boy even day roll bed mornin throw wanted go drink beer guy chase girl kick wanted never get confronted 'cause stick boy think could understand feel love girl swear better man listen 'cause know hurt lose one wanted 'cause taken granted everything got destroyed boy would turn phone tell everyone broken think sleepin alone put first make rule go 'cause know faithful waitin come home come home boy think could understand oh-ooh feel love girl swear better man listen 'cause know hurt lose one wanted 'cause taken granted everything got destroyed little late come back say mistake think forgive like thought would wait thought wrong boy understand feel love girl someday wish better man listen care hurt lose one wanted 'cause taken granted everything got destroyed boy
49,"""Turnin Me On""",Keri Hilson featuring Lil Wayne,https://genius.com/Keri-hilson-turnin-me-on-lyrics,yeah like shawty fly hell swagger right brown skin poppin know talk know like turnin turnin turnin wait minute lil buster got one time feel booty better recognize lady—that way turnin turnin turnin better recognize real woman ahh-ahh-ahh ahh ever try get close better come correct 'proachin dime diva give ahh-ahh-ahh ahh got ta feelin energy got ta sure recognize real woman goin actin like want stuntin like daddy checkin little mama turnin turnin turnin wait minute lil buster even know wan na take shopping lame tell big poppin turnin turnin turnin better recognize real woman wan na holler cutest broad get drawer got money try buy bottle got dollars—i could buy bar wanted ahh-ahh-ahh ahh ever try get close better come correct 'proachin dime diva give ahh ahh ahh ahh got ta feelin energy got ta sure ah-ah-ah ah-ah ahem recognize real woman ha verse 3 lil wayne fly hell swagger right brown skin poppin like dynamite raw like china white mama dig persona right look baby mama-type know got kinda hype ice albino-white hope vagina tight go underwater hope piranha bite hahaha hot carter i'ma kiss spot i'ma kiss till scream—wait minute mother ha yeah turn like handle like television weather channel 'cause make rain girl call wayne girl earthling never wayne world play win bait 'em thing love alien polow beat weezy f. plate keri pitch i'ma swing away someone better play fence someone better tell 'em 'bout baby shit thing smell around weezy f. baby forget f around get f 'round bridge lil wayne keri hilson turnin yeah yeah polow told got ms. keri baby chorus keri hilson lil wayne ahh-ahh-ahh ahh ever try get close better come correct 'proachin dime diva give ahh ahh ahh ahh yeah yeah yeah got ta feelin energy got ta sure recognize real woman hahaha yeah ms. keri baby young weezy baby young mula baby hahaha ayo keep vocal polow man laugh yeah
50,"""I Hate This Part""",Pussycat Dolls,https://genius.com/The-pussycat-dolls-i-hate-this-part-lyrics,driving slow snow fifth avenue right radio hear talked since left overdue cold outside u worse world slows heart beat fast right know part end start ca take longer thought stronger linger slipping finger wan na try left good-bye find way tell hate part right hate part right ca take tear hate part right every day seven take old scene seems bound law routine got ta talk go sleep sleep tell hurting world slows heart beat fast right know part end start ca take longer thought stronger linger slipping finger wan na try left good-bye find way tell hate part right hate part right ca take tear hate part right know ask hold carry like nothing wrong time lie 'cause see sunset eye ca take longer thought stronger linger slipping finger wan na try left good-bye find way tell got ta got ta got ta hate part got ta got ta got ta oh hate part right hate part right ca take tear hate part right
