No.,Title,Artist,Lyrics_URL,Lyrics
66,"""Smack That""",Akon featuring Eminem,https://genius.com/Akon-smack-that-lyrics,intro akon eminem shady konvict upfront akon slim shady see one could lady ayy feel creepin see shadow wan na jump lamborghini gallardo maybe go place kick like tae bo possibly bend look back watch smack floor smack give smack 'til get sore smack oh smack floor smack give smack 'til get sore smack oh upfront style ready attack pull parking lot slow 'lac konvict got whole thing packed step club wardrobe intact feel dawnin cracked ooh see dull backed i'ma call put mack money problem pocket full feel creepin see shadow wan na jump lamborghini gallardo maybe go place kick like tae bo possibly bend look back watch smack floor smack give smack 'til get sore smack oh smack floor smack give smack 'til get sore smack oh oh look like another club banger better hang throw thang get little drink gon flip akon shit bank pedicure manicure kitty-cat claw way climb pole lookin like one putty-cat doll tryin hold woodie back drawer step stage think saw creep behind like you're— like know let cut chase time waste back place plus club crib like mile away like palace shall say plus got pal gal game fact one singin song playin feel creepin see shadow wan na jump lamborghini gallardo maybe go place kick like tae bo possibly bend look back watch smack floor smack give smack 'til get sore smack oh smack floor smack give smack 'til get sore smack oh eminem rollin 'em rollin bu marvelous rollin woman ho-in big booty rollin soon throwin hittin less three block wheel style like whee girl tell want 'cause lately feel creepin see shadow wan na jump lamborghini gallardo maybe go place kick like tae bo possibly bend look back watch smack floor smack give smack 'til get sore smack oh smack floor smack give smack 'til get sore smack oh
67,"""One Wish""",Ray J,https://genius.com/Ray-j-one-wish-lyrics,talk minute know thinkin lot good time together everything together yeah would wake early mornin get car ride remember used watch sunrise used watch sunset everything know damn miss day could could hold arm know mean feel good could one wish damn baby understand went wrong gave heart gave soul gave you— matter fact one said loved first eight year ago act like know sittin home mama livin room 'cause could alone see mama knew somethin else knew felt back school favorite excuse growin fool ca lie missin listen trip think need bottle genie wish list first one would create heart-changin love second one take fill third one need lot wish 'cause okay get one one wish would best friend love would never end would begin one wish would boo promise love trust trust one wish would run away makin love day u baby one wish make whole life wife make right time one wish one wish one wish one wish one wish one wish one wish one wish one wish one wish one wish one wish one wish tell way get right back searchin go sho lovin holdin kissin girl tell feelin make-believe swear lose second chance would know probably check kind clinic could alone without sick wish list first one would create heart-changin love second one take fill third one need lot wish 'cause okay get one one wish would best friend love would never end would begin one wish would boo promise love trust trust one wish would run away makin love day u baby one wish make whole life wife make right time one wish even know ended road even though grown girl want know one wish would best friend love would never end would begin one wish would boo promise love trust trust one wish would run away makin love day u baby one wish make whole life wife make right time one wish would best friend love would never end would begin one wish would boo promise love trust trust one wish would run away makin love day u baby one wish make whole life wife make right time one wish one wish one wish one wish one wish one wish one wish one wish one wish one wish one wish one wish one wish
68,"""Sugar, We're Goin Down""",Fall Out Boy,https://genius.com/Fall-out-boy-sugar-were-goin-down-lyrics,bargained yet dyin tell anything want hear 'cause week lie grass next mausoleum notch bedpost line song drop heart break name always sleeping sleeping wrong team goin earlier round sugar going swingin number one bullet loaded god complex cock pull goin earlier round sugar going swingin number one bullet loaded god complex cock pull bargained yet oh mind watching two closet wishing friction jean messed dyin notch bedpost line song drop heart break name always sleeping sleeping wrong team goin earlier round sugar going swingin number one bullet loaded god complex cock pull goin earlier round sugar going swingin number one bullet loaded god complex cock pull earlier round sugar going swingin number one bullet loaded god complex cock pull going earlier round sugar going swingin number one bullet loaded god complex cock pull goin goin loaded god complex cock pull goin earlier round sugar going swingin number one bullet loaded god complex cock pull
69,"""Gimme That""",Chris Brown featuring Lil Wayne,https://genius.com/Chris-brown-gimme-that-lyrics,woo oh storch yeah s. dot ooh woah dynamic duo oh wo-womp-womp-wo-womp-womp-wo-womp wo-womp body saying wo-womp-womp-wo-womp-womp-wo-womp-wo-womp chris brown building young boy turned sixteen got six four hot bike rock keep three four sweetie clock swinging bikini make 'em vicious slow traffic complete stop 'cause speak slang talk sassy tempo walk may reason teenies may never see momma may three year older hot talking like like got know like lean 'lac could back saying gim gim gim momma may three year older hot talking like like got know like lean 'lac could back saying gim gim gim take break let explain body got young boy ready take chance let put thangs could show make straight school hustler trust frame age got thinking young turn page picture u switching lane coupe phone screaming name momma may three year older hot talking like like got know like lean 'lac could back saying gim gim gim momma may three year older hot talking like like got know like lean 'lac could back saying gim gim gim wo-womp-womp-wo-womp-womp-wo-womp-wo-womp girl serious watching wo-womp-womp-wo-womp-womp-wo-womp-wo-womp body saying wo-womp-womp-wo-womp-womp-wo-womp-wo-womp hey yeah wo-womp-womp-wo-womp-womp-wo-womp-wo-womp body saying momma may three year older hot talking like like got know like lean 'lac could back saying gim gim gim momma may three year older hot talking like like got know like lean 'lac could back saying gim gim gim v.a. yeah ha yeah fronting like know going aight yeah
70,"""I Know You See It""",Yung Joc,https://genius.com/Yung-joc-i-know-you-see-it-lyrics,ms. b eenie meeny miney moe many bitch club want go knowwww see knowwww see like eenie meeny miney moe many nigga club want go knowwww see knowwww see call tip drill playin song throw couple one throw away thong bust open take picture phone love cologne call purp zone pussy poppin yeah goin slap waitress booty tell get another round make rain money ground fresh force one sean john buttoned like ohh boy click full star big fo'-fifth big dick big car end day said done i'mma need fo freak cause need one eenie meeny miney moe many bitch club want go knowwww see knowwww see like bim bam know want chewin dick like piece bubble yum knowwww see knowwww see like eenie meeny miney moe many nigga club want go knowwww see knowwww see like dim damn know want chewin pussy like piece bubble yum knowwww see knowwww see never type show club real laid back poppin plenty bottle bub smoke got much perk get nigga real high make slurp burp could groupie hear singin song like see lem feel yo tongue ms. b nigga let get laced take step back blow pussy face talkin kush nigga talkin rat race many choose give 'em lil taste got house full pussy madame hip-hop bitch superstar gushy need mop yeahhh eenie meeny miney moe many bitch club want go knowwww see knowwww see like bim bam know want chewin dick like piece bubble yum knowwww see knowwww see like eenie meeny miney moe many nigga club want go knowwww see knowwww see like dim damn know want chewin pussy like piece bubble yum knowwww see knowwww see ms. b got stack deck snowflake neck new j foot make outfit complete knowwww see knowwww see got stack deck nigga love flow got mohawk blowin urr force glow knowwww see knowwww see eenie meeny miney moe many bitch club want go knowwww see knowwww see like bim bam know want chewin dick like piece bubble yum knowwww see knowwww see like eenie meeny miney moe many nigga club want go knowwww see knowwww see like dim damn know want chewin pussy like piece bubble yum knowwww see knowwww see
71,"""Who Says You Can't Go Home""",Bon Jovi featuring Jennifer Nettles,https://genius.com/Bon-jovi-who-says-you-cant-go-home-lyrics,spent twenty year tryin get place lookin something could replace runnin away thing ever known like blind dog without bone gypsy lost twilight zone hijacked rainbow crashed pot gold done looking back seed sown savin dime spendin much time telephone say ca go home say ca go home one place call one hometown boy born rollin stone say ca go home say ca go back around world matter fact one place left wan na go say ca go home alright alright alright alright alright went far could tried find new face one line would erase lived million mile memory road every step take know alone take home boy boy home street life ever known say ca go home say ca go home one place call one hometown boy born rollin stone say ca go home say ca go back around world matter fact one place left wan na go say ca go home alright alright alright alright alright say ca go home alright alright alright alright alright say ca go home done looking back long long road feel like never left story go matter matter go million mile away mile road take take go say ca go home say ca go home one place call one hometown boy born rollin stone say ca go home say ca go back around world matter fact one place left wan na go say ca go home alright alright alright alright alright alright alright alright alright alright alright say ca go home alright alright alright alright alright say ca go home alright alright alright alright alright say ca go home
72,"""Too Little Too Late""",JoJo,https://genius.com/Jojo-too-little-too-late-lyrics,mmh mmh ... mmh-mmh come stay night say word boy feel right ya expect say take hand say changed boy know begging fool game let 'cause time made strong starting move gon na say chance come gone know ... little late little wrong ca wait know right thing say know little late say dream face like like chase real matter anyway know little late yeah yeah little late mmh-mmh young love gave everything enough wan na communicate huh go find someone else letting go loving got problem come asking help 'cause know ... little late little wrong ca wait know right thing say know little late say dream face like like chase real matter anyway know little late love heart baby know much give player like prayer way live oh oh-ooh mmh whoa whoa little late yeah yeah little late little wrong ca wait know right thing say know little late say dream face like like chase real matter anyway know little late yeah yeah yeah yeah know little late ca wait ... little late little wrong ca wait know right thing say know little late say dream face like like chase real matter anyway know little late
73,"""Touch It""",Busta Rhymes,https://genius.com/Busta-rhymes-touch-it-lyrics,touch bring pay watch turn leave start format touch bring pay watch turn leave start format touch bring pay watch turn leave start format touch bring pay watch turn leave start format touch bring pay watch turn leave start format king sound busta bus back put lock town lot bitch comin mile around see comin cause know god get know holdin throne gim crown nigga salutin tryna give pound really fuck nigga nigga clown making bitch strippin throw shit ground way go spot shit flooded hoe see make hot chick come clothes get mami already know suppose shorty wildin shorty open beastin record second freaking tryna touch see peepin turned around tryna put dick mouth let touch bring pay watch turn leave start format touch bring pay watch turn leave start format touch bring pay watch turn leave start format touch bring pay watch turn leave start format started got ringin bell come doin doin well beat coochie makin swell tryna hide smell sex spraying chanel try walk strut one could tell nigga got butt made everything jail chick wild like nut blowin cell ca get enough kid put spell crowded mami move along know 'bout get removin thong whip back truck belong yac see type raunchy shit street nigga respect movement strong 'cause consistently rep see money long bitch wit see singing song plus give 'em stick dickin along let touch bring pay watch turn leave start format touch bring pay watch turn leave start format touch bring pay watch turn leave start format touch bring pay watch turn leave start format god block see back every single time drop shit wrap nigga hatin kid close strap cause bitch wan na come talk sit lap every time give bang shit knock ya whip nigga always thing bitch lockin strip lot mamis dancin shakin hip get low put thing lip let touch bring pay watch turn leave start format touch bring pay watch turn leave start format touch bring pay watch turn leave start format touch bring pay watch turn leave start format
74,"""Rompe""",Daddy Yankee,https://genius.com/Daddy-yankee-rompe-lyrics,know los capo están ready la mamis están ready en la calle estamos ready yeah yeah andamos ready los barrio están ready one two get ready come oh oh oh oh rompe rompe rompe bien guilla rompe rompe rompe ese cuerpo ella lo— rompe rompe rompe bien guilla ready rompe rompe rompe break rompe rompe rompe way move ella lo— rompe rompe rompe break let go boo se limita la hora de romper su pum-pum con curvas más calientes que el sur right enséñame si tienes la actitud mami dale go dale go dale go go tiempo llegó el momento baby de perder el control trabájame ese cuerpo más que un shot de winstrol sube ese temperamento dame movimiento lento lento ella lo— rompe rompe rompe bien guilla rompe rompe rompe ese cuerpo ella lo— rompe rompe rompe bien guilla ready rompe rompe rompe break rompe rompe rompe way move ella lo— rompe rompe rompe break g-go g-go g-go g-go voy chillin tranquilo right buscando una gata que cae escondas todo eso que traes yo baby ¿qué e la que hay voy chillin tranquilo right buscando una gata que cae escondas todo eso que trae ¿qué pasa socio qué e la que hay pinche güey ¿pensaste que esto era un mamey vo dar break deja ese guille de scarface get way usted vende ni en ebay da pa na conmigo 'tás frito-lay chequea el swing que se le pega to'as la nenas más que un g-string yo soy la pesadilla de todo los dream team ya se te acabó el magazine conmigo te la guilles pa de listerine daddy te— rompe rompe rompe bien guilla rompe rompe rompe ese cuerpo ella lo— rompe rompe rompe bien guilla ready rompe rompe rompe break rompe rompe rompe way move ella lo— rompe rompe rompe break let go know oh oh en directo oh oh daddy yankee yo con los jedis monserrate dj urba fish jaja official daddy yankee cartel record en directo jajaja
75,"""Déjà Vu""",Beyoncé featuring Jay-Z,https://genius.com/Beyonce-deja-vu-lyrics,intro beyoncé jay-z bass uh hi-hat uh 808 uh jay uh-huh ready uh-huh let go get 'em uh-huh come come verse 1 jay-z beyoncé used run base like juan pierre run bass hi-hat snare used bag girl like birkin bag bag b boy hurtin brooklyn bay birthed everywhere nerve rap audacity curtain back b sting stand back baby seem like everywhere go see eye smile like breathe helplessly reminisce want compare nobody boy try catch control sexiness appealing ca let go oh know ca get 'cause everything see want substitute baby swear déjà vu know ca get 'cause everything see want substitute baby swear déjà vu seeing thing know ca dreaming saw walkin past almost called name got better glimpse looked away feel like losin boy try catch control sexiness appealing ca let go oh woah know ca get 'cause everything see want substitute baby swear déjà vu know ca get 'cause everything see want substitute baby swear déjà vu yes hova flow unusual baby girl already know h-o light dro cause gon need help tryna study bounce flow blow difference one take vein sniffin still dope po-po try convict thats no-go dough keep scale tippin like 4-4s like h-o-u-s-t-o-n blow wind chicago best ever argu-a-ment make list mad make hit like factory one one nuttin déjà vu baby ca go anywhere without thinking seems like everywhere true got ta déjà vu 'cause mind want get next plane care missin déjà vu boy try catch control sexiness appealing ca let go woah oh know ca get 'cause everything see want substitute baby swear déjà vu know ca get 'cause everything see want substitute baby swear déjà vu know ca get 'cause everything see want substitute baby swear déjà vu know ca get 'cause everything see want substitute baby swear déjà vu
76,"""Life Is a Highway""",Rascal Flatts,https://genius.com/Rascal-flatts-life-is-a-highway-lyrics,woo mm yeah life like road travel one day next day gone sometimes bend sometimes stand sometimes turn back wind world outside every darkened door blue wo haunt anymore brave free lover soar come ride distant shore wo hesitate break garden gate much time left today yeah life highway wan na ride night long goin way well wan na drive night long city town blood around love like loved road hand mozambique memphis night khyber pas vancouver light knock back blood lonely man load ca hold road rough know light come tell 'em survivor life highway well wan na ride night long goin way wan na drive night long gim gim gim gim yeah life highway well wan na ride night long goin way wan na drive night long distance misunderstanding look eye ooh yeah load ca hold road rough know light come tell 'em survivor life highway well wan na ride night long goin way well wan na drive night long life highway wan na ride night long goin way wan na drive night long life highway wan na ride night long goin way wan na drive night long
77,"""Call Me When You're Sober""",Evanescence,https://genius.com/Evanescence-call-me-when-youre-sober-lyrics,cry loved would want come find make mind let fall lose maybe remember ca keep believing deceiving sick lie late cry loved would want come find make mind could take blame sick shame must exhausting lose game selfishly hated wonder jaded ca play victim time late cry loved would want come find make mind never call sober want 'cause ah could burned paradise could never mine cry loved would lie get thing made mind
78,"""Jesus, Take the Wheel""",Carrie Underwood,https://genius.com/Carrie-underwood-jesus-take-the-wheel-lyrics,drivin last friday way cincinnati snow-white christmas eve goin home see mama daddy baby backseat fifty mile go runnin low faith gasoline long hard year lot mind pay attention goin way fast knew spinnin thin black sheet glass saw life flash eye even time cry scared threw hand air jesus take wheel take hand 'cause ca letting go give one chance save road jesus take wheel still gettin colder made shoulder car came stop cried saw baby backseat sleepin like rock first time long time bowed head pray said sorry way livin life know got change tonight jesus take wheel take hand 'cause ca letting go give one chance save road oh jesus take wheel oh letting go give one chance save road road jesus take wheel oh take take oh woah ooh
79,"""Show Stopper""",Danity Kane featuring Yung Joc,https://genius.com/Danity-kane-show-stopper-lyrics,car ride slow doin thing girl boy stare smile back girl rainbow cadillacs yeah verse 1 aubrey d. wood show stoppin latest spot ride shinin open top hydraulics make head go nod hair blowin breeze yo superstar put key make engine purr three back one passenger slow creepin 'cause look fly boy tryna taste candy rid e car ride slow doin thing girl boy stare smile back girl rainbow cadillacs yeah bet never seen chick ridin clean louis vuitton seat deadly keep poppin make sure bass knockin see u ridin call show stoppin show stoppin show show stoppin show stoppin show show stoppin keep poppin make sure bass knockin see u ridin call show stoppin verse 2 aundrea d. wood sittin twenty-two plus two mink bucket seat neon blue color coordinate shoe yeah diva ride like big boy black tinted white stripe interstate lookin mirror bad boy fitted yup show stoppin till lose breath turn wheel right turn wheel left car ride slow doin thing girl boy stare smile back girl rainbow cadillacs yeah bet never seen chick ridin clean louis vuitton seat deadly keep poppin make sure bass knockin see u ridin call show stoppin show stoppin show show stoppin show stoppin show show stoppin keep poppin make sure bass knockin see u ridin call show stoppin bridge dawn aubrey lady 280 mercedes h3 baby range bentley coupe escalade say oh oh break 'em somethin proper like real showstopper chicas beamers a6 '67 chevys maserati lexus say oh oh break 'em somethin proper like real showstopper gon jingle key gon jingle key put 'em real high make sho errybody see 'em one time two time three time four time gon jingle key gon jingle key put 'em real high make sho errybody see 'em one time two time three time four time car ride slow doin thing girl boy stare smile back girl rainbow cadillacs yeah bet never seen chick ridin clean louis vuitton seat deadly keep poppin make sure bass knockin see u ridin call show stoppin show stoppin show show stoppin show stoppin show show stoppin keep poppin make sure bass knockin see u ridin call show stoppin
80,"""Get Up""",Ciara featuring Chamillionaire,https://genius.com/Ciara-get-up-lyrics,uh uh yeah uh ow ow ow uh giddy get get get said hi name baby tell look like came one thing started left take right breath kept dancin night tryin admit ca fight feeling inside know see eye want smooth mother undercover way watchin ooh uh way look feelin uh ca help tryin keep cool uh feel beat uh thing uh let nothin stop move ring alarm club jumpin get said ciara radio everybody turn spicy like hot sauce careful might burn pop lock rag-top stop way got ta get get make body rock trying admit ca fight feeling inside know 'cause see eye want smooth mother undercover way watchin ooh uh way look feelin uh ca help tryin keep cool uh feel beat uh thing uh let nothin stop move ring alarm club jumpin get ooh love way vibe dance forever good time follow beat together one one breakin ca walk away got turn place ooh ooh kid stay ridin big one police tried catch ridin dirty club eleven o'clock like tryna catch dime kinda early lookin thick hair brown curly love way ride shinin pearly city boy say fine pretty country boy say fine purty pocket thick green curvy lady know soon see jewelry bein fresh death crime think time see jury know chamillionaire stay grind hustler like hard find really impressed yes unless dollar sign really need call fine know hearin time watchin step step yep going ooh uh way look feelin uh ca help tryin keep cool uh feel beat uh thing uh let nothin stop move ring alarm club jumpin get ooh uh way look feelin uh ca help tryin keep cool uh feel beat uh thing uh let nothin stop move ring alarm club jumpin get got baby uh feel got baby got baby uh feel got baby
81,"""We Be Burnin'""",Sean Paul,https://genius.com/Prezidential-candidates-im-goin-in-remix-lyrics,smokin cali kush boy sell bush packin heat .45 magnum belt shawty lookin fine wish could felt drugged bitch drug could melt feelin fine back hummer ridin main street stuntin like winner running long time feel safe say dpalm bust bomb rhyme write verse controversy look bitch fifteen call statutory smokin arabian shit know good stuff smoke hit back throat shit rough told sucker dpalm gon na murder investigation next bad rapper turnin mutilator fry bitch called frialator worked fast food fuck sayin wan na next rapper tv wan na enough succeeding smokin spliff hittin mauwie wowie shit drinkin 'til daze-y knockin back shot bacardi parental advisory sticker merchandise like gon na put fuck front merchant eye fuck dana carvey master disguise get high right clappin sky foolish plot kinda like flick mission impossible homeboy sayin shit got actin kinda pausible a.k.a actin gay concoct acronym prez gon na spray best believe word truest throw shit leaf lyin fluid young money co-signer please free weezy broadcast live like cable tv new league great like john wall burnin sean paul hard kill steven seagal goin like robber hide toddler window smash 'em tv grab 'em holler problem solution got 'em melt head layer like human gobstopper orville poppin smith wes glockin treat red light like bed night stoppin
