No.,Title,Artist,Lyrics_URL,Lyrics
1,"""Boom Boom Pow""",The Black Eyed Peas,https://genius.com/Billboard-longest-leading-hot-100-1s-december-16-2024-annotated,longest-leading hot 100 1 week 1 title artist date reached 1 19 “ bar song ” shaboozey july 13 2024 19 “ old town road ” lil na x feat billy ray cyrus april 13 2019 16 “ want christmas ” mariah carey dec. 21 2019 16 “ last night ” morgan wallen march 18 2023 16 “ despacito ” luis fonsi daddy yankee feat justin bieber may 27 2017 16 “ one sweet day ” mariah carey boyz ii men dec. 2 1995 15 “ ” harry style april 16 2022 14 “ uptown funk ” mark ronson feat bruno mar jan. 17 2015 14 “ got ta feeling ” black eyed pea july 11 2009 14 “ belong together ” mariah carey june 4 2005 14 “ candle wind 1997 ” “ something way look tonight ” elton john oct. 11 1997 14 “ macarena ” los del rio aug. 3 1996 14 “ make love ” boyz ii men aug. 27 1994 14 “ always love ” whitney houston nov. 28 1992 13 “ boy mine ” brandy monica june 6 1998 13 “ end road ” boyz ii men aug. 15 1992 12 “ shape ” ed sheeran jan. 28 2017 12 “ closer ” chainsmokers feat halsey sept. 3 2016 12 “ see ” wiz khalifa feat charlie puth april 25 2015 12 “ blurred line ” robin thicke feat t.i pharrell june 22 2013 12 “ boom boom pow ” black eyed pea april 18 2009 12 “ yeah ” usher feat lil jon ludacris feb. 28 2004 12 “ lose ” eminem nov. 9 2002 12 “ smooth ” santana feat rob thomas oct. 23 1999 11 “ box ” roddy ricch jan. 18 2020 11 “ god plan ” drake feb. 3 2018 11 “ independent woman part ” destiny child nov. 18 2000 11 “ missing ” puff daddy faith evans feat 112 june 14 1997 11 “ un-break heart ” toni braxton dec. 7 1996 11 “ swear ” all-4-one may 21 1994 10 “ easy ” adele oct. 30 2021 10 “ butter ” bts june 5 2021 10 “ feeling ” drake july 21 2018 10 “ one dance ” drake feat wizkid kyla april 23 2016 10 “ hello ” adele nov. 14 2015 10 “ happy ” pharrell williams march 8 2014 10 “ found love ” rihanna feat calvin harris nov. 12 2011 10 “ low ” flo rida feat t-pain jan. 5 2008 10 “ irreplaceable ” beyoncé dec. 16 2006 10 “ gold digger ” kanye west feat jamie foxx sept. 17 2005 10 “ dilemma ” nelly feat kelly rowland aug. 17 2002 10 “ foolish ” ashanti april 20 2002 10 “ maria maria ” santana feat product g b april 8 2000 10 “ physical ” olivia newton-john nov. 21 1981 10 “ light life ” debby boone oct. 15 1977
2,"""Poker Face""",Lady Gaga,https://genius.com/Lady-gaga-poker-face-lyrics,mum-mum-mum-mah mum-mum-mum-mah mum-mum-mum-mah mum-mum-mum-mah mum-mum-mum-mah wan na hold 'em like texas please fold 'em let 'em hit raise baby stay lovegame intuition play card spade start hooked play one heart oh woah-oh oh oh oh-oh-oh-oh-oh-oh get hot show got oh woah-oh oh oh oh-oh-oh-oh-oh-oh get hot show got ca read ca read ca read poker face ca read ca read ca read poker face p-p-p-poker face f-f-fuck face p-p-p-poker face f-f-fuck face wan na roll hard pair little gamblin fun russian roulette without gun baby love rough fun fun oh woah-oh oh oh oh-oh-oh-oh-oh-oh get hot show got oh woah-oh oh oh oh-oh-oh-oh-oh-oh get hot show got ca read ca read ca read poker face ca read ca read ca read poker face p-p-p-poker face f-f-fuck face p-p-p-poker face f-f-fuck face wo tell love kiss hug 'cause bluffin muffin lyin stunnin love-glue-gunnin like chick casino take bank pay promise promise check hand 'cause marvelous ca read ca read ca read poker face ca read ca read ca read poker face ca read ca read ca read poker face ca read ca read ca read poker face ca read ca read ca read poker face ca read ca read ca read poker face p-p-p-poker face f-f-fuck face p-p-p-poker face f-f-fuck face p-p-p-poker face f-f-fuck face p-p-p-poker face f-f-fuck face p-p-p-poker face f-f-fuck face p-p-p-poker face f-f-fuck face
3,"""Just Dance""",Lady Gaga featuring Colby O'Donis,https://genius.com/Lady-gaga-just-dance-lyrics,intro lady gaga akon truth redone konvict gaga oh-oh eh verse 1 lady gaga akon little bit much much people start rush dizzy twister dance ca find drink man key lost phone phone pre-chorus lady gaga akon goin floor love record baby ca see straight anymore woo keep cool name club ca remember alright a-alright dance gon na okay da-da-doo-doot-n dance spin record babe da-da-doo-doot-n dance gon na okay da-da-da-dance dance dance j-j-just dance verse 2 lady gaga akon wish could shut playboy mouth turn shirt inside control poison babe rose thorn say gettin hosed tonight pre-chorus lady gaga akon goin floor love record baby ca see straight anymore keep cool name club ca remember alright a-alright woo dance gon na okay da-da-doo-doot-n dance spin record babe da-da-doo-doot-n dance gon na okay da-da-da-dance dance dance j-j-just verse 3 colby o'donis akon come dance floor checking catalogue ca believe eye many woman without flaw gon give steady tryna pick like call i'ma hit i'ma beat latch onto tomorrow yeah shorty see got much energy way twirlin hip 'round 'round reason ca leave meantime stay let watch break chorus lady gaga akon dance gon na okay da-da-doo-doot-n dance spin record babe da-da-doo-doot-n dance gon na okay da-da-doo-doot-n dance spin record babe da-da-doo-doot-n dance gon na okay da-da-da-dance dance dance j-j-just dance incredible amazing music woo let go half psychotic sick hypnotic got blueprint symphonic half psychotic sick hypnotic got blueprint electronic half psychotic sick hypnotic got blueprint symphonic half psychotic sick hypnotic got blueprint electronic bridge lady gaga akon go use muscle carve work hustle got stay close enough get slow drive clean lysol bleed spend last dough got pock-o got dance gon na okay da-da-doo-doot-n dance spin record babe da-da-doo-doot-n dance gon na okay da-da-doo-doot-n dance spin record babe da-da-doo-doot-n dance gon na okay da-da-da-dance dance dance j-j-just dance
4,"""I Gotta Feeling""",The Black Eyed Peas,https://genius.com/Billboard-longest-leading-hot-100-1s-december-16-2024-annotated,longest-leading hot 100 1 week 1 title artist date reached 1 19 “ bar song ” shaboozey july 13 2024 19 “ old town road ” lil na x feat billy ray cyrus april 13 2019 16 “ want christmas ” mariah carey dec. 21 2019 16 “ last night ” morgan wallen march 18 2023 16 “ despacito ” luis fonsi daddy yankee feat justin bieber may 27 2017 16 “ one sweet day ” mariah carey boyz ii men dec. 2 1995 15 “ ” harry style april 16 2022 14 “ uptown funk ” mark ronson feat bruno mar jan. 17 2015 14 “ got ta feeling ” black eyed pea july 11 2009 14 “ belong together ” mariah carey june 4 2005 14 “ candle wind 1997 ” “ something way look tonight ” elton john oct. 11 1997 14 “ macarena ” los del rio aug. 3 1996 14 “ make love ” boyz ii men aug. 27 1994 14 “ always love ” whitney houston nov. 28 1992 13 “ boy mine ” brandy monica june 6 1998 13 “ end road ” boyz ii men aug. 15 1992 12 “ shape ” ed sheeran jan. 28 2017 12 “ closer ” chainsmokers feat halsey sept. 3 2016 12 “ see ” wiz khalifa feat charlie puth april 25 2015 12 “ blurred line ” robin thicke feat t.i pharrell june 22 2013 12 “ boom boom pow ” black eyed pea april 18 2009 12 “ yeah ” usher feat lil jon ludacris feb. 28 2004 12 “ lose ” eminem nov. 9 2002 12 “ smooth ” santana feat rob thomas oct. 23 1999 11 “ box ” roddy ricch jan. 18 2020 11 “ god plan ” drake feb. 3 2018 11 “ independent woman part ” destiny child nov. 18 2000 11 “ missing ” puff daddy faith evans feat 112 june 14 1997 11 “ un-break heart ” toni braxton dec. 7 1996 11 “ swear ” all-4-one may 21 1994 10 “ easy ” adele oct. 30 2021 10 “ butter ” bts june 5 2021 10 “ feeling ” drake july 21 2018 10 “ one dance ” drake feat wizkid kyla april 23 2016 10 “ hello ” adele nov. 14 2015 10 “ happy ” pharrell williams march 8 2014 10 “ found love ” rihanna feat calvin harris nov. 12 2011 10 “ low ” flo rida feat t-pain jan. 5 2008 10 “ irreplaceable ” beyoncé dec. 16 2006 10 “ gold digger ” kanye west feat jamie foxx sept. 17 2005 10 “ dilemma ” nelly feat kelly rowland aug. 17 2002 10 “ foolish ” ashanti april 20 2002 10 “ maria maria ” santana feat product g b april 8 2000 10 “ physical ” olivia newton-john nov. 21 1981 10 “ light life ” debby boone oct. 15 1977
5,"""Love Story""",Taylor Swift,https://genius.com/Taylor-swift-love-story-lyrics,young first saw close eye flashback start standing balcony summer air see light see party ball gown see make way crowd say hello little know romeo throwing pebble daddy said stay away juliet cry staircase begging please go said romeo take somewhere alone waiting left run prince princess love story baby say yes sneak garden see keep quiet 'cause dead knew close eye escape town little oh oh 'cause romeo scarlet letter daddy said stay away juliet everything begging please go said romeo take somewhere alone waiting left run prince princess love story baby say yes romeo save trying tell feel love difficult real afraid make mess love story baby say yes oh oh got tired waiting wondering ever coming around faith fading met outskirt town said romeo save feeling alone keep waiting never come head know think knelt ground pulled ring said marry juliet never alone love really know talked dad go pick white dress love story baby say 'yes oh oh oh oh oh oh 'cause young first saw
6,"""Right Round""",Flo Rida,https://genius.com/Flo-rida-right-round-lyrics,chorus flo rida kesha spin head right round right round go go spin head right round right round go go hey walk house swagger hop go got place go people see time precious look cartier outta control like mind goin woman shorties nothin clothes stoppin pirellis roll like jewelry always gold know storm comin pocket keep tellin gon na shower call homies poppin tonight 'cause meant keep fadeaway shot 'cause ballin platinum patron lil mama owe like flower girl truth goody power 'cause chrous flo rida kesha spin head right round right round go go spin head right round right round go go top pole watch go got throwing money around nothing beautiful found going top pole watch go got throwing money around nothing beautiful found going hey shawty must know man money love like number one fan open mouth let talk band benjamin frank-a-lins couple grand got rubberbands paper plane making dance get dirty night part plan building castle made sand amazing fire blazing hotter cajun girl wo move lil closer time get paid maximum wage body belongs poster daze bottom waving like dammit know show like gun holster tell whatever chauffeur 'cause chrous flo rida kesha spin head right round right round go go spin head right round right round go go top pole watch go got throwing money around nothing beautiful found going top pole watch go got throwing money around nothing beautiful found going yeah spending money outta control somebody help taking bank roll king club wearing crown popping bottle touching model watching ass go chrous flo rida kesha spin head right round right round go go spin head right round right round go go spin head right round right round go go spin head right round right round go go
7,"""I'm Yours""",Jason Mraz,https://genius.com/Jason-mraz-im-yours-lyrics,well done done bet felt tried chill hot melted fell right crack trying get back cool done run giving bestest nothing gon na stop divine intervention reckon turn win learn wo hesitate wait mm mm well open mind see like open plan damn free look heart find love love love love listen music moment people dance sing one big family godforsaken right loved loved loved loved loved wo hesitate wait sure need complicate time short fate want come scootch closer dear nibble ear woah oh-oh woah oh oh oh oh-oh-oh-oh-oh ah-ha mhm spending way long checking tongue mirror bending backwards try see clearer breath fogged glass drew new face laughed guess saying better reason rid vanity go season aim name virtue wo hesitate wait well open mind see like wo hesitate open plan damn free look heart find wait sky sure please please please need complicate need complicate time short 'cause time short fate oh oh fate ah oh oh oh oh woah baby believe best believe best believe mhm mhm
8,"""Single Ladies (Put a Ring on It)""",Beyoncé,https://genius.com/Beyonce-single-ladies-put-a-ring-on-it-lyrics,single lady single lady single lady single lady put hand club broke doin lil thing decided dip wan na trip 'cause another brother noticed pay attention 'cause cried tear gave ya three good year ca mad 'cause like put ring like put ring mad see want 'cause like put ring woah-oh-oh oh-oh-oh oh-oh-oh oh-oh-oh woah-oh-oh oh-oh-oh oh-oh-oh oh-oh-oh 'cause like put ring like put ring mad see want like put ring got gloss lip man hip tighter deréon jean actin drink cup care less think need permission mention pay attention 'cause turn gon learn really feel like miss bey 'cause like put ring like put ring mad see want 'cause like put ring woah-oh-oh oh-oh-oh oh-oh-oh oh-oh-oh woah-oh-oh oh-oh-oh oh-oh-oh oh-oh-oh 'cause like put ring like put ring mad see want like put ring woah-oh-oh oh-oh-oh oh-oh-oh oh-oh-oh woah-oh-oh oh-oh-oh oh-oh-oh oh-oh-oh treat thing world kind girl love prefer deserve man make take delivers destiny infinity beyond pull arm say one want alone like ghost gone single lady single lady single lady single lady put hand woah-oh-oh oh-oh-oh oh-oh-oh oh-oh-oh woah-oh-oh oh-oh-oh oh-oh-oh oh-oh-oh woah-oh-oh 'cause like put ring like put ring mad see want like put ring woah-oh-oh 'cause like put ring like put ring mad see want like put ring woah-oh-oh
9,"""Heartless""",Kanye West,https://genius.com/Kanye-west-heartless-lyrics,night hear 'em talk coldest story ever told somewhere far along road lost soul woman heartless could heartless oh could heartless could cold winter wind breeze yo remember talkin though need watch way talkin yo mean thing mean thing got ayo know thing told ayo thing old wan na get back gon show walk around like know got new friend well got homies end still lonely night hear 'em talk coldest story ever told somewhere far along road lost soul woman heartless could heartless oh could heartless could dr. evil bringin side know decided gon speak 3 a.m. phone mad fo homie know hot cold wo stop wo mess groove ‘ cause already know thing go run tell friend leavin say see see wait couple month gon see never find nobody better night hear 'em talk coldest story ever told somewhere far along road lost soul woman heartless could heartless oh could heartless talk talk talk talk baby let knock know know 'bout got somethin new see gon keep hatin gon enemy know ca believe could leave wrong ca make right gon take tonight night night hear 'em talk coldest story ever told somewhere far along road lost soul woman heartless could heartless oh could heartless
10,"""Gives You Hell""",The All-American Rejects,https://genius.com/The-all-american-rejects-gives-you-hell-lyrics,wake every evenin big smile face never feel outta place still probably workin 9 5 pace wonder bad taste see face hope give hell hope give hell walk way hope give hell hope give hell picket fence love shiny car ever get far never seemed tense love never seen fall hard know truth told miss truth told lyin see face hope give hell hope give hell walk way hope give hell hope give hell find man worth damn treat well fool well hope give hell hope give hell tomorrow thinkin yeah go wrong list go truth told miss truth told lyin see face hope give hell hope give hell walk way hope give hell hope give hell find man worth damn treat well fool well hope give hell never see done take back memory good lie look eye sad sad look wear well see face hope give hell hope give hell walk way hope give hell hope give hell hear song sing along never tell fool well hope give hell hear song hope give hell sing along hope put hell
11,"""You Belong with Me""",Taylor Swift,https://genius.com/Taylor-swift-you-belong-with-me-lyrics,phone girlfriend upset going something said 'cause get humor like room typical tuesday night listening kind music like never know story like 'cause wear short skirt wear t-shirt cheer captain bleacher dreaming 'bout day wake find looking whole time could see one understands along ca see belong belong walk street worn-out jean ca help thinking ought laughing park bench thinking hey easy got smile light whole town seen since brought say fine know better hey whatcha girl like wear high heel wear sneaker cheer captain bleacher dreaming 'bout day wake find looking whole time could see one understands along ca see belong standing waiting back door time could know baby belong belong oh remember driving house middle night one make laugh know 'bout cry know favorite song tell 'bout dream think know belong think know ca see one understands along ca see belong standing waiting back door time could know baby belong belong belong ever thought maybe belong belong
12,"""Dead and Gone""",T.I. featuring Justin Timberlake,https://genius.com/Ti-dead-and-gone-lyrics,ayy let kick right quick man gangsta shit man real shit anybody done thing sure feel way big phil pimpin chorus justin timberlake t.i. oh travelin road long tryin find way back home old dead gone dead gone oh travelin road long tryin find way back home old dead gone dead gone hey ever one day wish woulda stayed home run group nigga gettin hate walk get wrong reply shit get blown way outta proportion way past discussion pick one rush figure get jumped hell nothin wan na stop bustin gushin ambulance rushin hospital bad concussion plus hit four time bullet hit yo spine paralyzed waist-down wheelchair-bound never mind lucky alive think started fussin three guy pride way pride way could fuck around get shot die day nigga die everyday bullshit dope money dice game ordinary hood shit could ‘ cause hip hop music one good sense use usually nigga know back wall start shootin red blue blow guess bankhead yo project stress straight get take time think make mistake family sake part left yesterday heart strong today regret blessed say old dead gone away chorus justin timberlake t.i. oh travelin road long tryin find way back home old dead gone dead gone oh travelin road long tryin find way back home old dead gone dead gone hey never scared lived tragic situation coulda dead lookin back shit even happen think trappin apartment hangin smokin rappin nigga start shit next thing know cappin get locked even get mad think damn life shit look back laugh shit still look back get sad maybe homeboy still around hit nigga mouth time fight lost war still see nigga walkin door who'da thought never see philant got enough dead homies want cost nigga jaw cost i'da took ass-whoopin sure think risk life take chance get stripe nigga put hand alright otherwise stand talk shit night 'cause hit sue shoot get locked stress straight get take time think make mistake family sake part left yesterday heart strong today regret blessed say old dead gone away chorus justin timberlake t.i. oh travelin road long tryin find way back home old dead gone dead gone oh travelin road long tryin find way back home old dead gone dead gone hey turn head east see nobody side turn head west still nobody sight turn head north swallow pill call pride old dead gone new alright turn head east see nobody side turn head west still nobody sight turn head north swallow pill call pride old dead gone new alright 'cause chorus justin timberlake t.i. oh travelin road long tryin find way back home old dead gone dead gone oh travelin road long tryin find way back home old dead gone dead gone hey
13,"""You Found Me""",The Fray,https://genius.com/The-fray-you-found-me-lyrics,found god corner first amistad west alone smokin last cigarette said said ask anything everything fallin apart day spent telephone never rang needed call never came corner first amistad lost insecure found found lyin floor surrounded surrounded wait little late found found well end everyone end alone losin one ever known wan na way know long next lost insecure found found lyin floor surrounded surrounded wait little late found found early mornin city break callin year year year year never left message never sent letter got kinda nerve takin want lost insecure found found lyin floor lost insecure found found lyin floor surrounded surrounded wait little late found found wait find find
14,"""Use Somebody""",Kings of Leon,https://genius.com/Kings-of-leon-use-somebody-lyrics,roamin around always lookin see painted face fill place ca reach know could use somebody know could use somebody someone like know speak countless lover cover street know could use somebody know could use somebody someone like night live sleep wagin war shape poet beat hope gon na make notice hope gon na make notice someone like someone like someone like somebody let let let let let let let someone like somebody someone like somebody someone like somebody roamin around always lookin see
15,"""Knock You Down""",Keri Hilson featuring Kanye West and Ne-Yo,https://genius.com/Keri-hilson-knock-you-down-lyrics,haha oh supposed happen keep rockin keep knockin whether louboutin reebokin see hate servin platter gon na dessert disaster never thought love like look mind go trip came knocked face feel like race already first place never thought fall hard got thinking 'bout life house kid yeah every morning look smile 'cause boy came around knocked knocked sometimes love come around knock get back knock knock sometimes love come around knock get back knock knock never thought hear say y'all go 'head think gon na kick girl today used commander-in-chief pimp ship flyin high 'til met pretty little missile shot sky hit crashin know feel damn good said could go back know would baby could miss independent load never much helpin pull shot bullet ended life swear pimp died tonight girl sometimes love ... chorus keri hilson ne-yo sometimes love come around aye oh come around knock hey hey get back knock knock ooh knock oh sometimes love come around ooh-ooh yeah come around knock oh whoa get back knock knock knock knock tell make past casper finally fly nasa always cheerleader dream seemed date head football team class clown always kept laughing never meant baby happened please mess trick hey young world new slick rick say move quick ca let moment pas u let hourglass pas right ash let wind blow ash right glass wrote love letter right class could goddess ask someone average advice omg listen bitch woe baby tragic 'cause magic flyin crashing bad real bad—michael jackson mad real mad—joe jackson leave boyfriend i'ma ask got ta take good bad happy sad well bring better future past oh 'cause wan na make mistake wan na fall back face mmh-mmh admit scared answer love call hit better make worth fall come around hey chorus keri hilson ne-yo sometimes love come around come around whoa knock get back knock knock get back knock sometimes love come around love come around knock eh-eh oh-oh get back knock eh-eh oh-oh knock knock knock outro keri hilson ne-yo keri hilson ne-yo wo see coming happens eh happens uh-huh gon na feel let tell see love come knock oh knock wo see coming happens oh-oh happens ooh gon na feel let tell tell see love come knock yeah
16,"""Blame It""",Jamie Foxx featuring T-Pain,https://genius.com/Jamie-foxx-blame-it-lyrics,deep blame goose gotcha feelin loose blame 'trón got zone blame a-a-a-a-a-alcohol blame a-a-a-a-a-a-a-a-a-alcohol aye said usually know frontin 'cause shawty know want wan na seem like easy hear saying wo know probably gon fiendin deep insi-i-i-ide let u-u-up girl drinkin gon let sink weekend thinkin see could press fast forward one round pouring fill another cup feelin butt even care unaware fine buzz set buzz set blame goose gotcha feelin loose blame 'trón got zone blame a-a-a-a-a-alcohol blame a-a-a-a-a-alcohol blame vodka blame henny blame blue tap got feeling dizzy blame a-a-a-a-a-alcohol blame a-a-a-a-a-a-a-a-a-alcohol oopsie spilled drink knowin tipsy put body keep staring right eye tellin gon baby would rather show missin li-i-i-ife get insi-i-i-ide girl drinkin gon let sink weekend thinkin see could press fast forward one round pourin fill another cup feelin butt even care unaware fine buzz set buzz set chorus jamie foxx t-pain blame goose gotcha feelin loose blame 'trón got zone blame a-a-a-a-a-alcohol blame a-a-a-a-a-alcohol blame vodka blame henny blame blue tap got feeling dizzy blame a-a-a-a-a-alcohol hey blame a-a-a-a-a-a-a-a-a-alcohol t-pain girl know feel good like look couple shot open like book trippin shawty trippin i'ma take shot nuvo shawty know going go kick like judo know mean shawty got drunk thought dream made say ah ah-ah got hand leg got seat wet ride ride look dead eye eye-eye pant got bigger already knew figure lookin boyfriend like fuck nigga chorus jamie foxx t-pain blame goose gotcha feelin loose blame 'trón got zone blame a-a-a-a-a-alcohol blame a-a-a-a-a- alcohol blame vodka blame henny blame blue tap got feeling dizzy blame a-a-a-a-a-alcohol blame a-a-a-a-a-a-a-a-a-alcohol ballers poppin bottle henny cup screamin money thang throw sky hold drink high independent mama buy bottle lookin like model broke fella holla tell 'em bye hold drink high blame goose gotcha feelin loose blame 'trón got zone blame a-a-a-a-a-alcohol blame a-a-a-a-a-alcohol blame vodka blame henny blame blue tap got feeling dizzy blame a-a-a-a-a-alcohol blame a-a-a-a-a-a-a-a-a-alcohol
